"","X","user","review"
"1359",1358,"Seleucid","It's a coffee table book. It's little proverbs and military advice that the strategy gamer in me enjoyed (I found myself bookmarking many quotes).You don't have to be a general to enjoy it however, as the parts about leadership and how to know your adversaries can be used in more than one battlefield.For such ancient wisdom...enjoyable throughout."
"1360",1359,"Leslie Ann","Good audiobook. Sun Tzu's prose is clear and punctuated with many lists (it would be interesting to consider alternative lists). Anecdotes and music enhance the listening experience."
"1361",1360,"Ahmed El-Kelany","مجموعة من النصائح والمواعظ المباشرة .. يعتبر من كلاسيكيات فنون الحرب ، لكن يمكن أيضا الاستفادة منه في الحياة العملية العامة "
"1366",1365,"Maren","A good one to have under the belt. More beneficial for me because I read it for the purpose of discussing it with others. "
"1369",1368,"Neha","Great book. I would love to find a version that can bridges the tenets and modern day challenges. "
"1372",1371,"Jonathas Soares","""To begin by bluster, but afterwards to take fright at the enemy's numbers, show a supreme lack of intelligence""Neil DeGrasse Tyson recommends this to all humans so that we can “learn that the act of killing fellow humans can be raised to an art.” Very true indeed. I wonder if historically towering military leaders would agree with all of Sun Tsu's tactics. I look forward to reading Julius Caesar's account of his campaign in Gaul to compare stratagems. One of the reasons this is still widely read is because many of the techniques described here can be applied to psychological warfare, business strategies and competitive settings in general. Sun Tsu principal lessons are: - All warfare is based on deception('when able to attack, we must seem unable', 'appear where you are not expected');- he will win who knows when to fight and when not to fight;- he will win who knows how to handle both superior and inferior forces;- know thyself;- force your enemy to reveal himself, so as to find out his vulnerable spots;- avoid what is strong and attack at what is weak;- always expect the enemy;- if soldiers are punished before they grow attached to you, they will not prove submissive;- seize something which your opponent holds dear;- what enables generals to achieve more than ordinary men is foreknowledge;- knowledge of the enemy's dispositions can only be obtained from other men, not from intuition;It makes you wonder if human nature will ever allow for John Lennon's version of the world described in Imagine to exist."
"1373",1372,"Clint Priest","Classic by Sun Tzu, an oral and written treatise on war and how to win. This is a tough read both because of content and the translation. Recommended, but again, it is very tough."
"1374",1373,"Mark Schlechty","Interesting. I always wanted to read this famous work.Very interesting. Probably nothing I will ever use directly, but since we learn through analogy and supposition, maybe it will benefit me in some unforeseen way. The commentary that ran through the book wasn't expected. It kind of reminded me of how people will study and parse the Bible."
"1375",1374,"Nerdish Mum","The book took me just over an hour to read and was surprisingly easy to read. I expected a lot more detail and more indepth descriptions. The writing style was almost lyrical or like poetry and so that was how I read it in my mind. I don't really know how to review this book as it is so different to everything I normally read. Yes I feel it is an important book and I am glad that I read it. As to whether I think it is still relevant, maybe. Some people say that you can relate certain things to your work life instead of war, but I'm not entirely certain that it would be necessary. I know this is short and sweet but I really don't have a lot to say about this book"
"1380",1379,"Volkan Kurt","Her strateji oyunu oynayan adamın bildigi seyleri yazmıs cevirmen kitabın ilk ceyreğinde acıklama üstüne acıklmama yapmış şu kısımda sunu anlatmıs surda sunu soylemek istemis gibi. ama kitap başlayınca hep bilindik seyler örnek vermek gerekirse1. Düşmanın zayıf zamanını bekle 2. Düşmanın zayıflıklarını araştır.3. Düşmanın zayıflat 4. Düşman zayıflayınca sen güçlen5. Düşman zayıfladı sen güclendinya bi zahmet saldır gibi.belki vakti zamanında bunlar bayatlammasken bu kitap guzeldir."
"1384",1383,"Glenn","The CD audio format does not lend itself to taking your time with a classic, rich text such as this, but the information before and after the 13 chapters was excellent."
"1385",1384,"Eduard Chekhov","Too obvious for the guy with a bachelor degree in management "
"1389",1388,"Thys","Difficult read - not something that keeps you intrigued for pages on end.Nevertheless it proves that some concepts are timeless."
"1390",1389,"Kwesi","So there are a bunch of different versions of The Art of War. Almost all have commentary along with the translation. I chose this version by Lionel Giles because it has both the translation with commentary and the translation without. I just read the plain translation, which is pretty short (like around 80 pages). There's also an introduction which gives a brief history of the era Sun Tzu lived in and how his book came to be. It's interesting and worth a skimming.As for the actual book, it's alright. There are some interesting premises, but nothing ground-breaking, in my opinion. I think this is one of those books you like to say you've read to look cool. If you're bored or really like ancient Chinese warfare, it's worth a read. Otherwise, I wouldn't really bother. Then again, it's so short that you might as well blast through it if you have any interest whatsoever."
"1399",1398,"Katharine","This was a hard book for this suburban mom to get through, but I'm glad I did. Some of it was very fascinating. Made me want to get out a set of toy soldiers. "
"1403",1402,"Tommy","Short and interesting from a historical prospective. Much of the strategy seems way ahead of its time."
"1404",1403,"Adrian","A classic that all should read. Some timeless advice here. "
"1405",1404,"Jason Kopp","Overrated and archaic, but maybe I just don't have the combative nature needed to fully appreciate the book =)"
"1407",1406,"Brecken","Political Science; freshman year of college. I had an intelligent teacher with lots of diverse insight and anecdotal advice. By the end of the semester I had a good page long list of to-reads, due to the book references he always managed to sidle into his lectures. Amongst this inventory was a book entitled ""The Art of War"". This one continually got brought up throughout his tangents, and I found myself really wondering what it was all about (not disregarding the title) and who would write such a thing. But my humanly curiosity got the best of me and I soon found myself sifting through it's pages. I was surprised at how quick and easy of a read this was. I'm not quite sure what I really WAS expecting, but this did turn out to be different than what I must have subconsciously imagined. The almost ""bulleted"" outline made the chapters fly by quickly and before I knew it, it was over.I'm truthfully glad I took the time to read it, and found some truly ingenious schemes and thorough forethoughts that sculpted the mind of a wise and perceptive sage. I remember my poli sci professor remarking that the undertaking of this treatise was for the benefit of a king during Sun Tzu's time. What I do not know is if the king was hungry for power or simply smart and cultivated in his leadership, defense, and wartime appeal. But regardless, Tzu writes to someone that should be smart, compassionate, quick, cultivated, but yet aggressive in their wartime actions. But even with his shrewd knowledge, I often felt like Tzu was contradicting himself and talking himself in circles (taking into account the philosophical era it was written in). Regardless, he makes a bold point, and although times have changed; it is knowledge we even day can learn from."
"1408",1407,"Maddlyn","Short, useful, great!"
"1409",1408,"Mateus Santos","Interesting and full of information that should be used in daily life, not just in war (I think many politicians do this). Obviously, just read ""Art of War"" don't make you the Warlord Master of Battlefields, mainly because of the fact that the way we make war have developed a lot (guided missiles, man!), but even so It's a great book about tatics of war.But, because of the fame that the book carries, I was waiting something more impressive so my reading was kinda disappointing.Chapter XII is the best (kill it with fire!)."
"1411",1410,"Leon","A lot of the stuff presented in this book is self-evident and doesn't really apply directly to modern life. However, the mindset of being in War (both physical and mental), and preparing for battle hits a nerve to this day. Of course, remember that while it is good to prepare for battle, the best is not to fight at all. :)"
"1412",1411,"Anusooya"," 3 1/2. I know of few books that are quoted as much as this book. For that reason and the fact that I am fascinated by strategic thinking I found this a very quick read. The edition I listened to was a compilation of multiple translations and also included historical examples of his tenants in practice. The later was especially interesting."
"1413",1412,"z","confession - read the Asiapac comic version. forgot how many of those comics I used to read as a kid. got the gist of it, and it felt moderately applicable to real life. need to find a condensation of it"
"1418",1417,"Ahmed Shreef","A must read for military officers, but has some interesting points and tactics for dealing with people in day to day interactions; enemies, friends, and co-workers you're leading. I think that's why the book sometimes gets recommended for CEOs. You will get bored when he starts focusing more on detailed war tactics, but the book is a short read, read once and highlight the interesting points."
"1419",1418,"Maq","Dobra i ciekawa książka. Niestety trzyma ""formę"" z epoki kiedy powstawała. Dlatego ciężko się to czyta. (coś jak przypowieści biblijne)."
"1420",1419,"Nada Elfeituri","I was hoping this book would teach me how to wage war in my spare time, but instead it discusses what to do if you already find yourself in a war. It should be renamed ""Tips and Tricks on Maintaining a War"", so potential mongers are not misled. The advice in general is sound, although some of it was kind of obvious. ""Do not camp on entrapped terrain, do not pursue feigned retreats"". Well, duh. I also question the wisdom of viewing your army as children. With all the lists present in this book concerning terrain, types of armies, generals and spies, I wouldn't be surprised that if Sun Tzu were alive today, he'd be a Buzzfeed contributor (no offense). ""3 Types of Spies To Watch Out For In Your Next Battle"", ""The 9 Terrain Types Every Good General Should Know"". In all seriousness, it was an interesting read, and surprisingly timeless. I suppose what he wrote could be used by armies today. "
"1423",1422,"Bradley Eylander","The book had good insight on strategy and can be applied to modern warfare. About half of the book is common sense strategies in war, while the other half contains understanding I didn’t see prior to reading this book. The author had good insight on each passage and included additional understanding of certain passages with other commentators of the book.I think I had a bad translation or reading it on the iTouch was a poor choice because the author commented on each passage WAY too much. Mid-sentence the author would write a mini paragraph on either an example of a certain strategy being carried out in war or more meaning to the phrase. It’s good to read the phrase first, and then read the commentary because stopping mid-sentence occasionally causes me to forget what was being said by Sun Tzu before the commentary.I heard they made an art of war for business, which I can see because businesses are trying to compete with other businesses"
"1424",1423,"Don Gubler","Now if I decide to wage war I will know how. As if I would ever want to do that. Perhaps there are other applications."
"1427",1426,"Nadim Khalil","This book was not easy at all, but it has really great information and strategies anyone can benefit from. It always fascinates me how very old books still can be helpful today..."
"1428",1427,"Mac","This took about an hour, and I am now ready both to wage war and perform leveraged buyouts on unwilling corporations. See you on Wall Street, folks. "
"1430",1429,"Kelton Baker","I liked the book for what it was, a guide to making war with a winning strategy. I think I completely miss the point of using this book as a guide to achievement in the business world and other ways people use this book. I also noticed the author seems to have a preference for avoiding war altogether which I appreciate and many of those hyping this book do not."
"1433",1432,"John Wiswell","The Art of War is a brilliant book. There's no argument against it. The hundred or so pages of dense, boring, self-indulgent and overacademic analysis these people surrounded it with are not so brilliant. They grind most of what you might find useful down into a thin intellectual powder, and spread it so thin that it takes a good deal of willpower to get through it. If you have this edition, just skip to the original text, and give their stuff a look afterwards, if you liked what you read."
"1436",1435,"Julius","lovely"
"1438",1437,"AN","I love reading non-fiction on the tram, so this book popped in my mind right away when I was rambling on Bookdepository. This one I specifically note down how many time I have read it. It deserves to be read over and over again, and I myself yearn for many other half-an-hours reading and pondering over it on the tram. ""The Art of War"" is a very short and concise book indeed. It scares me, but excites me at the same time. I will try other English or Viet translations and other books of this genre for sure. "
"1443",1442,"Elisabetta","Credo che per capire davvero un libro del genere bisogna fare molte letture approfondite. Sono d'accordo con il commento all'edizione che ho (di Wu Ming): molto probabilmente tutti quei manager che leggono Sun Tzu - così com'è o rivisitato - non hanno capito granché dei principi del maestro orientale."
"1445",1444,"Demian Kendall","Ineffective in getting my landlord to fix my washing machine."
"1446",1445,"Adam Burch","Eh. "
"1450",1449,"Lars","Shaping up to be a very good book. I picked this version of the three available at my Half-Price Books store, because it seemed to have better commentary."
"1451",1450,"Chase Bourg","I can see why The Art of War is viewed as such an important strategy book for war and business. There are fantastic bits of insight and knowledge in it. However, I felt Sun Tzu began to get a bit repetitive at times, as he sort of rambled on too often."
"1452",1451,"Jim","This wasn't exactly what I was expecting."
"1460",1459,"John Yarbrough","I had a difficult time paying attention. I think this would have been a better read. I enjoyed the quotes by great warriors over the years from Napoleon to Eisenhower. A book I should read with another application applied to it (i.e. business)"
"1462",1461,"V Smith Smith","Interesting."
"1465",1464,"Johannes Stellwagen","""basically a little facist handbook on how to use plausible ideas in order to totally destroy your fellow man""-John Minford"
"1468",1467,"Faisal Al-mubarak","كتاب استراتيجي كتبه سن تسو الحاكم في إدارة الحروبيعتبر الكتاب استراتيجيا فضلا عن كونه حربياتعتمد عليه الشركات في المفاوضات المالية"
"1469",1468,"Simone Collins","It's really fun to consider the advice in terms of non-war like things. Such as engagement with bosses. Or rivals. Or one's own crazy mind. What fun!I think that I may sit down and read this again someday- probably when I find myself confronted with a task that I do not know how to tackle. If I just substitute my problem for the military references, I'll probably be able to come up with a halfway decent strategy!"
"1472",1471,"Nathan Rodeberg","I probably lack the direct conflict and/or creativity to apply this to my life, but it was an interesting read"
"1473",1472,"Harshit Vaishnav","Its literally about Art of War. How to plan, how to attack etc. If you want to know how it relates to _your_ life, you will have to read some other analysis of this book. All in all, a not-bad read."
"1474",1473,"Adam Gilchrest","Really useful information in how to destroy friendships through the board game Risk."
"1477",1476,"Abeer Al-Souli","كما يظهر من عنوانه، كتاب يتحدث عن فنون الحرب عبر نصائح وتلميحات يجب ألا يغفل عنها القادة..كتاب جميل رغم أن بعض النقاط بدت لي بديهية ومعروفة أو مكررة ومعادة.الكتاب وإن كان عن الحرب إلا أنه يمكن أيضاً الاستفادة منه في العمل وجوانب الحياة الأخرى.. - قرأت النسخة الإلكترونية من ترجمة رؤوف شبايكوأرى أن ترجمته ممتازة وتستحق الإشادة."
"1480",1479,"Kamal Yagubov","Good book, presents some interesting points about warfare and tactics, although the translator did not do a spectacular job. The majority of Sun Tzu's teachings are lost in today's world of technology, a world where a nuclear warhead can be delivered from one superpower to the other within 30 minutes. I liked it, but the only use this book can have nowadays is for wishful readers to try and interpret the messages and apply them to their everyday lives, which I found quite difficult to do.Most memorable quote: ""If words of command are not clear and distinct, if orders are not thoroughly understood, the general is to blame. But if his orders ARE clear, and the soldiers nevertheless disobey, then it is the fault of their officers."""
"1484",1483,"Mike Kirkpatrick","Interesting but don't see how it is so often spoken of as inspirational. Or as a guide for successful war campaigns, unless there have been more wars and battles won by waiting and control of resource portioning. Most battles I've heard of were often fought by soldiers who had overcome running out of resources. Nonetheless worth reading. "
"1485",1484,"Deyaa Sabry","كتاب بسيط ومفيد في حالة اهتمامك بالاستراتيجيات العسكرية بل وبعض قواعد القيادة والادارة عامةولكن المترجم أضاف العديد من التكرارات والتمهيدات في أول الكتاب لا تدعها تصيبك بالمللوستجد مزيد من الايضاحات من المترجم للنسخة الأصلية للكتاب"
"1492",1491,"Reed","More of a reference book than a good read but contains some excellent wisdom."
"1495",1494,"Mark O'Hearn","Now that I'm ready for battle....who wants some?"
"1496",1495,"Kersplebedeb","This is a book of aphorisms, kinda like a taoist militarist's fortune cookie collection. Plus a long intro arguing the taoist context of the book, and commentaries on the aphorisms by several Chinese authors from centuries past. i read all the aphorisms, and skimmed all the commentary.Some of the observations i think are quite useful. Plus there'll be bonus cred if you quote Sun Tzu, just b.coz the book has such a rep. But many work only as metaphors, because the era of warfare they describe is so far removed from our own - i mean i can see why the book is so popular, it combines the mystique of warfare and ""ancient Chinese writings"" with advice that is very open to interpretation, and so open to being used as a ""strategy guide"" for anyone from frustrated CEOs to aspiring politicos.Because of what i'd been told, i was expecting more a coherent argument or science of warfare, similar to what i found in Clausewitz. This is not that.i also found it interesting that much of the advice, to the degree that it might apply to non-state armed movements, tends to what i consider the fascist rather than the communist pole. I.e. the idea of inscrutability, of purposefully ""untransparent"" strategies. While this is good for us on a tactical level, on the level of strategy it flies in the face of any empowering strategy, which should ideally be comprehensible by ordinary people, which means unfortunately by our opponents."
"1497",1496,"Tushar","How to win wars without fighting, or at least without fighting too much.""The enlightened ruler lays his plans well ahead; the good general cultivates his resources.""- Sun Tzu (Chinese General & Military Strategist)"
"1499",1498,"John Hutton","This book is so applicable for business today."
"1500",1499,"Sandip Roy","A timeless masterpiece written in the times of BC articulating the width and depth of strategy and tactics in the context of war, laws of governance and fundamentals of running a strong state...... each and every chapter is relevant in todays's time and how so many countries may already be infleunced by it along with PRC....."
"1504",1503,"Giorgio","***Letto più per curiosità che per vero interesse.Devo dire che l'edizione economica della Newton Compton (comprata a soli 0.99 €) è ben curata: si pone molta attenzione alla traduzione, il testo è infatti arricchito da numerose note che spiegano meglio il contesto storico dell'opera o alcuni concetti dal significato complesso di difficile traduzione. Bella anche la premessa di Wu Ming (anche se un po' provocatoria, ma è nel loro stile) che aiuta a cogliere l'importanza e il significato de ""L'arte della guerra"".Anche quando sembra fare affermazioni ovvie, quest'opera appare moderna se si pensa è del v secolo a.C. circa. Oltre ai vari consigli strategici sull'esercito e i preparativi per una battaglia, Sunzi non incita alla guerra, anzi, elogia chi riesce ad ottenere vittorie sul nemico senza ingaggiare uno scontro, e consiglia di trattare con onore e rispetto il nemico sconfitto.Tra tutti i principi esposti, nel testo la frase che m'ha colpito di più è stata ""La guerra è fondata sull'inganno"", frase che per me risuona quanto mai attuale. "
"1505",1504,"Modesty_b","I think I read most if not all the book. I read the translated english version and it was just the literal translation and there was no interpretation as to how to apply it to our daily lives. My opinion ,as captain Nagata says in ""Battleship"" ... ""that book is Chinese""......... hero ""it still makes no sense."" lol"
"1511",1510,"Oriol Farré"," Te algunes frases molt bones, però és MOLT espès... "
"1515",1514,"Mohamed Tayelseed","The book is nice in terms of great sayings that most of them you can apply into your own profession, career, leadership skills But it doesn't flow smoothly in terms of reading, it maybe due to the translation between Chinese and English "
"1517",1516,"Vee","The subtitle of this book is ""Break Through the Blocks and Win Your Inner Creative Battles"". I read this book on a recommendation I hears at a recent writer's workshop. It's an easy read and full of snippets of wisdom. However, I'm not sure how much it actually helped me in my writing process. i plan to re-read parts of it in the coming weeks."
"1518",1517,"Nico","I think I needed to read it slower and with more contemplation."
"1520",1519,"Charliesabers","A compilation of ancient treaties that will forever be relevant. Not a particularly enjoyable read, but interesting and essential for any would be strategist. Can be applied in many facets of life."
"1522",1521,"K.D. Absolutely","This is a timeless classic on management. I also heard the generals and politicians read this novel as the principles on power and war in this book can be applied to in those arenas. Originally written in Chinese, the principles are stated very simply yet meaningful. I could not quote anything in verbatim though. Maybe I am not yet in that level of thinking that I needed to consult a book in order to make decisions in the office or at home."
"1528",1527,"jonathan","i prefer machiavelli."
"1531",1530,"Alyssacourtney","Thought provoking. Applicable to life, relationships, work, politics and war."
"1533",1532,"James Violand","Very fundamental axioms of strategies put forward by an ancient Chinese general. Influential even today not only in military matters but in the business world as well."
"1534",1533,"Alkis Romeos","not what people think of it"
"1536",1535,"Nada  Abandah","Honestly, I have to admit that I expected much more... I insisted on reading the original text translated, and it was not a very good read! The main ideas are great, but to us at this stage it became somehow too repeated and over-used! I wish someone would rewrite it in a more structured and good manner (and I'm sure they have, but not sure which version is the best). "
"1537",1536,"Sidney Weber","Should be studied rather than readBelieve this is the oldest extant book treating warfare as a science. Presentation is very poor. Should have two columns, one for text and other for commentary.Being so old, much of advice is either old hat or out of date. Book is set of precepts. To use it, one must generalize both the precepts and the current situation. No way to predict its utility absolutely or relative to other alternatives."
