"","X","user","review"
"863",862,"Pupsi","I can see why people expand this to business and life in general, but for me it is a military book of its time. It is evident that this book help consolidate best practice into one book. That is not to say that some of the lessons cannot be applied to other areas but I did not find the master key book that people describe. Having said that it was enjoyable, however I did find that this is one of the few books where listening to the audio book made it easier to understand."
"864",863,"Cdee","Been on my TBR for the longest time and it was a really quick read. Not overly impressed but has some good ideas. "
"865",864,"Sophistre","Debated as to a fourth star, but decided to run with 'how enjoyable it is as a read' rather than 'how critical and essential a work it is'.Lots of reviews in here about how this book is a whole lot of nothing new, I see. What seems to be going somewhat unrecognized is that these concepts are nothing new  in large part because of this book .Worthwhile to keep in mind as you pour over concepts formed in the 6th century, BC."
"866",865,"Spuddie","What can I say? The book itself was very short and sweet. Not much of a book at all, really...more like an instruction manual. About how to conduct war. And, as much as I hate war, the ideas made sense and could be applied to most any competitive situation, or at least parts of them. Most of the content of the 'book' was actually commentary about the book, interpretations and the like--and even commentary on the commentary, which was just silly."
"869",868,"Wouter","""What the ancients called a clever fighter is one who not only wins, but excels in winning with ease."""
"875",874,"Winfrida Jackson","he was mostly thinking of attacks rather that making diplomats, talking of war techniques shows violence and not peacefully."
"876",875,"Beau Johnston","I might have been too young when I first read this book, or just not in the right frame of mind. I found it a little tiring trying to keep up with the place names on the tiny maps.But having said that; I did get some good information from the book and it has returned to my to-read pile. "
"885",884,"Gerald","This book was not as big a deal as it's made out to be, but still a deal of some size. I guess. Whatevs, I've already forgotten the whole thing, except for one awesome insight --- ""Deception is the critical element in war."" Not a bad takeaway.Love,Marty"
"886",885,"Khaled","كتاب ممتع حقاً ، حاولت الحصول على هذا الكتاب بعد نصيحة أسداها لي أحد أستاذتي الأفاضل . عندما حصلت على الكتاب كنت دائماً أتردد في قراءته بحسب أنه كتاب له علاقة بالحروب ، ولكن لدهشتي ، الكتاب خاصة بالإستراتيجيات ، مركز جداً لخبرة عميقة جداً.أنصح بقرائته."
"889",888,"Ellem","I understand the undercurrent of what this book is trying to convey. I just don't like the delivery. "
"890",889,"Jason Ch'in","it tells some Chinese style tactics,it's the tactics of PLA also,if you can't ignore current Chinese Army,you'd better read it. what i said is just for joke,don't be nervous,haha"
"891",890,"Kevin Holsters","J’avais envie de lire ce petit essai sur la guerre pour changer de genre. Ce titre m’avait aussi fort intrigué dans le passé et je n’avais jamais su le lire entièrement. Prenant mon courage et ma volonté à deux mains, j’ai enfin lu cet ouvrage chinois classique, cet essai sur la stratégie de guerre et je vous offre, aujourd’hui, mon appréciation dessus. Tout d’abord, j’ai très apprécié le stratège qu’était Sun Tzu. Dans les articles décrits dans le livre, nous voyons toute la stratégie et la réflexion qu’il y a derrière les mots. Pour apprécier tout ce qui est écrit, nous devons nous immerger dans le passé, trois siècles avant le nôtre, lorsque les moyens militaires étaient très réduits comparés à maintenant. Une fois notre esprit acclimaté à cette époque, nous pouvons vivre ce que ce général de l’armée chinoise nous dévoile et nous pouvons observer toute la finesse d’esprit de cet homme de guerre qui, par expérience et par réflexion, nous dévoile une manière de se battre qui, dans le passé et encore aujourd’hui, était révolutionnaire et synonyme de victoire. En effet, nous ne pouvons douter de la victoire d’une patrie qui utilisait cette stratégie, tout est bien réfléchi et gagner, si la stratégie est appliquée correctement, est la suite logique de l’histoire. Nous sommes un peu comme dans une recette. Nous avons les ingrédients et la préparation devant nous. Le bête type qui suivra la recette mot pour mot aura une chance sur cinq de réussir la recette tandis que celui qui variera un peu la dose des ingrédients aura plus de chances. Maintenant, si on ne suit pas la recette, nous allons perdre, à moins d’être un bon cuisinier, un excellent général de guerre. Certaines recettes donnent des bons gâteaux et d’autres donnent des gâteaux encore meilleurs, quelle victoire allez-vous choisir ? De plus, Sun Tzu est un très bon pédagogue et explique clairement sa technique de guerre sans que le lecteur soit désavantagé à cause de son non-expérience dans la stratégie militaire. Expliquer l’art de la guerre à des civils qui ne se sont jamais intéressés à la guerre est un défi que notre général asiatique a relevé et a réussi. Ce n’est jamais évident d’expliquer son métier, l’art de son métier à quelqu’un qui a des préjugés dessus ou qui n’y connaît rien. Pour lui faire comprendre, nous devons exceller dans notre fonction pour lui expliquer le plus clairement possible. Ce général devait être une grande étoile dans l’art militaire car je n’ai eu aucune difficulté à comprendre sa stratégie et à avoir un tableau d’ensemble. Je suis dans des études de comptabilité et quand j’essaye d’expliquer ce qu’est le métier de comptable, j’observe beaucoup de préjugés comme quoi la comptabilité sont des mathématiques par exemple et je peux vous dire que c’est faux. Oui, il y’a une part de calculs mais la plupart se font automatiquement avec Excel ou les logiciels comptables. Chaque métier a son art, chaque fonction a son but et chaque personne de métier ne peut être pédagogue. C’est ainsi que j’ai été impressionné par la facilité de compréhension de cet essai sur la stratégie militaire. Pour terminer, certaines parties de ce livre pour ne pas dire toutes peuvent être interprétés pour une guerre plus diplomatique ou spirituelle. Une guerre n’est pas que des combats sanglants en corps-à-corps mais cela peut-être également en politique ou entre deux partis qui se livrent la guerre à coups de circulaires et de lois. Cela peut également être un combat intérieur que se livre une personne dans un changement de situation, une réflexion sur lui-même, une mise au point sur elle-même. C’est parfois assez dur de trouver le sens moral des mots car à la base, ce livre n’est pas écrit pour ce genre de situations mais bien pour la vraie guerre. Néanmoins, nous savons considérer les propos de l’auteur avec plus de sens sous-entendu si on se concentre et qu’on se creuse les méninges. Nous sommes dans une théorie qui nous pousse à affronter le problème et non à le laisser derrière nous ou en nous. C’est une façon de penser que je prône et que je trouve peu agressive mais très efficace. Nous analysons le problème et modifions ses composantes pour en faire un problème. C’est moins violent que d’affronter le problème à âme perdue. Je pense vraiment que c’est intéressant de réfléchir au sens profond des mots, de la stratégie décrite dans ce livre. En conclusion, j’ai assez bien aimé ce livre pour un essai militaire et je recommande ce bouquin aux intéressés.http://leslecturesdekevin.blogspot.be..."
"892",891,"Bubba","meals in this house are not occurring in a timely manner. talking about it is having no effect. i am required to rethink my tactical dispositions. some good advice here, but many of these strategies depend on assets that i cannot acquire such as digital opposition. advice on variability seems to be on target, for instance communicating from another room alternated with attempting to push the glowbox off of laps seems to have a desired effect at least some of the time. other advantageous times to become strategic are: right before the temporary departure of other inhabitants, or immediately before nightly retiring. i will nap on what i have learned and try again tomorrow with the eventual goal of uninterrupted supply of sustenance."
"893",892,"Michael_bruno","ok no storyline it is all about how to win a war/battle"
"896",895,"Hollie Bush","Not a difficult read per se, but some parts were more difficult than others in terms of finding relevance to my modern life. I did however learn that by decapitating two poor performers you make the remainder of the group into better performers. As a manager I found this to be a very helpful bit of information. Now where's my guillotine?"
"899",898,"Teri","The whole time I was reading this (on a short trip to Portland, Oregon, including on the airplane) I kept asking myself, ""Why am I reading this?"" And I'd answer, ""Why not?"" It's pretty cool to be able to read something this ancient AND something not intended for me --- a note I read explained that Sun Tzu's writing would have been intended solely for those in charge of the war. So... I read. And now I wait. I just know that eventually in my little life SOMETHING is going to come up that will cause me to reflect on what I learned in The Art of War and I will make note and be satisfied. "
"901",900,"Anuradha","Buddy read with Ashley! :DYeah, this was disappointing. Too much background information, and not enough, well, art of war. I think I need to buy another edition and give it another go."
"903",902,"Natasha González","Este es un libro muy bueno, a pesar de ser escrito en tiempos antiguos es muy aplicable para los tiempos actuales, trata sobre como Sun Tzu antiguo guerrero chino hace uso de sus tácticas aprendidas en las batallas para dar concejos a cerca de como puedes enfrentar a tu oponente, dando ejemplos de otros guerreros y sus batallas o derrotas, además de hacer mención de sus consejos.Las enseñanzas que te deja luego de leerlo son muy útiles para la vida diaria, cualquiera que se el problema que se te presente en la vida, a pesar que su nombre sea el arte de la guerra, cuando haces un profundo análisis, tu forma de pensar a cerca de los inconvenientes de la vida será totalmente diferente, mas acertada y objetiva. Muy bueno para las personas que se encuentras en los negocios y a todos en general."
"907",906,"Nuno Gaspar","Interesting, but was expecting more. Anyway, nice read."
"910",909,"Tom Jose","What he is saying in the book is more common sesnse and applicable even today, but not in war anyway. The game is changed a lot today from the times it is written."
"911",910,"Meisam Shahbazi","چرا باید این کتاب را بخوانیمدوهزار و پانصد سال پیش مردی به نام “سان تزو” تصمیم میگیرد تمام تعالیم جنگی اش را مکتوب کند. او کتابی مینویسد و به پادشاه وقت پیشکش میکند و نام اش را “هنر جنگ” مینامد و این کتاب تبدیل به کتاب شماره یک تاریخی در حوزه جنگاوری دنیا میشود که حتی در حوزه موفقیت, کسب و کار و تجارت نیز بسط داده میشود…کتاب هنر جنگ یک کتاب کوچک و ساده با 13 فصل است. در هر فصلی استراتژی و تاکتیک های جنگی گنجانده شده است که باید فرمانده نیروی زمینی از آن پیروی کند تا بر دشمن پیروز شود. این کتاب برای اولین بار از چینی به فرانسوی ترجمه شد و سپس توجه فرماندهان انگلیسی را جلب کرد و در سال 1905 به انگلیسی نیز ترجمه شد.سان تزو معتقد بود جنگ باعث ضرر اقتصادی میشود و حد الامکان نباید وارد جنگ شد مگر برای پیروزی و به گفته خودش” پادشاهی که در 100 جنگ 100 بار پیروز شده کاری مضحک انجام داده. هر فرماندهی باید قبل ازینکه دشمن برایش تهدیدی به حساب بیاید نابودش کند… ” __سان تزواین کتاب علارغم نامش توانست قشر وسیعی از خوانندگان را به خود اختصاص دهد. اگر از معرفی در سریال های تلوزیونی بگذریم این کتاب یکی از کتاب های کارآفرینان و تاجران بزرگ دنیا است. این کتاب حاوی استراتژی هایی برای پیروزی است؛ پیروزی در هر جایی.پیروزی فقط مختص به جنگ های انسانی نیست. در هر عرصه ای از زندگی باید پیروز باشیم؛ زندگی, ورزش, درس ,تجارت و … این کتاب اصول پیروزی را می آموزد.این کتاب چنان اصول حرفه ای و دقیقی در خود دارد که سخنگوی سازمان دفاع آمریکا در ایراد هایش درباره چگونگی دفاع از کشورشان از “سان تزو” و کتاب هنر جنگ نقل قول میکند.اولین آموزه از 13 آموزه ی سان تزو می گوید: ""اگر چیزی را میخواهید بدست آورید و آن چیز برای شما ارزش زیادی دارد؛ هرگز بر رویش ریسک نکنید. فقط زمانی حرکت کنید که مطمئن هستید پیروز میشوید…""این یک استراتژی جنگی است؛ اما نه فقط در میدان جنگ.برای مثال در آخرین اصل سان تزو به جاسوسان جنگی می پردازد و به شما میگوید به جای صرف انرژی، زمان و هزینه هنگفت برای بدست آوردن پیروزی بهتر است از جاسوسان جنگی استفاده کنید. در زندگی جاسوسان جنگی کارایی چندانی ندارند اما شما میتوانید قبل از اینکه وارد کسب و کاری شوید و تجارت خودتان را شروع کنید؛ تا میتوانید اطلاعات جمع آوری کنید و بعد وارد کار شوید تا هزینه آزمون خطا و انرژی و … بیهوده تلف نشود.چه کسانی بیشتر میتواننند از این کتاب استفاده کنند؟هر کسی میتواند با هر دیدگاهی از این کتاب استفاده کند. اما این کتاب در دنیای پر رقابت امروز بیشتر نظر مدیران و کارآفرینان و ورزشکاران بنام دنیا را جلب کرده.مدیران ،کارآفرینان و ورزشکاران دنیا کسانی هستند که مدام باید با شکست دست و پنجه نرم کنند. انرژی ،زمان و پولشان را باید بهینه مصرف کنند و کاملا استراتژیک وارد هر رقابتی شوند."
"912",911,"Samiam","Yea, avoid battle. Aikido style."
"915",914,"Gagan Ahluwalia","I think, for a person like me, this book translates as a guide to life. "
"916",915,"Christopher Brunetto","Notes and explanations took up an unnecessary amount of space and made the text somewhat convoluted. I would've preferred just the straightforward writings of Sun-Tzu, although the effort and depth of the additional information is appreciated."
"917",916,"Satya","Every animal with blood in its veins and horns on its head will fight when it is attacked. How much more so will man, who carries in his breast the faculties of love and hatred, joy and anger! The 2500 year old classic, The Art of War, which was revered by the Chinese, is a compendium of military science. In my opinion, this book can be condensed into one saying -- If you know the enemy and know yourself, you need not fear the result of hundred battles. If you know yourself but not the enemy, for every victory gained, you will also suffer a defeat. If you know neither the enemy nor yourself, you will succumb in every battle...by Sun Tzu, a philosopher and a great general!"
"918",917,"Brenna","Another good audio-book for falling asleep too. It was a tad strange listening to an Irishman read this since I've so long associated it with Asian culture, but Mr. Gillen did a really excellent job keeping fairly dry subject matter interesting. It's a pretty fascinating study of conflict. I knew very little about it beyond the title and the fact the author was an ancient Chinese philosopher of sorts, thus was pleasantly surprised to find the emphasis in his discussions of ""war"" and conflict is victory without conflict or bloodshed. And his arguments are as straightforward as they are compelling. I surprised myself with how much I enjoyed this one. "
"922",921,"Ahmad  Ebaid","""القائد الذي يصغي لمشورتي ويعمل بها - سيقهر وينتصر, ومن هم مثله يجب أن يستمروا في موقع القيادة. القائد الذي لا يصغي لمشورتي فلا يعمل بها – سيعاني الهزيمة, ومن هنا يجب أن يصرفوا من الخدمة""
الكتاب هو واحد من أهم وأندر مخطوطات العالم القديم, يتحدّث عن فنون الحرب العسكرية, كتبه حكيم صيني في القرن السادس قبل الميلاد تقريبا, وفي تقدير مؤرخين آخرين في حدود القرن الثالث قبل الميلادتعود أهميته لبقاء أغلب ما فيه صالح للاستخدام حتى الآن, حتى إنه وزع منه نسخ على جنود الجيش الأمريكي أثناء حرب الكويت أول ترجمه ليه كانت على يد ثلاثة من الساموراي اليابانيين, ثم ترجم للفرنسية 1772 وتبعتها ترجمة روسية 1860, ثم ترجمات انجليزية وألمانيةنسخة دار الكتاب العربي, النصف الأول منها هو 8 مقالات تحليلية للكتاب, والنصف الثاني هو متن الكتاب 13 فصل عن فنون الحرب يرى اتزو أن الحرب هي مجرد وسيلة سياسية تستعمل عندما لا تنفع الوسائل الأخرى, وأن الحرب ينبغي تجنبها طالما سنحت الظروف, ولكن في بعض الأحيان تضطر إلى الدخول فيها,وإذا دخلت الحرب فاحرص على أن تنتهي بسرعة, فالحرب التي تستغرق وقتا طويلا هي حرب يخسر فيها الطرفين بغض النظر عن الغالب والمغلوب كما تستهلك قوت الشعوب لتمويلها, وعليك أن تحصل على مؤنتك من أقرب مكان لك لتوفير مصاريف النقل, وإن كنت خارج بلادك في مكان لن تستطيع أن تستعيده ثانية فلا بأس أن تنهب أهلهومن افكاره أيضاً: ""إحراز مئة انتصار في مئة معركة ليس هو الأفضل بل إن إخضاع العدو من دون قتال هو أفضل ما يكون""""الحرب خدعة"" ""عندما يفاوض العدو بكثير من التواضع في حين يتابع استعداداته فهو سيهاجم, وعندما يتحدث مفاوضوه بشكل مخادع واستفزازي بينما وحداته تتقدم بشكل استعراضي فهو لن يهاجم"""
"924",923,"John Winston","Wasn't quite sure how to rate this or how I felt about it. I had heard so much about it that I felt compelled to read it, not once, but three times. It was an easy read thank goodness for that. I'm guessing it applies to all things and that it's benefit to me will come out in my daily life situations. The bottom line is, it really is a treatise on the strategy of war and combat...duh...just like it says. I guess I was expecting something esle...that spoke to daily life the way it is now...and maybe it does when you think about. I'm just saying. John Darryl Winston"
"926",925,"Jamie","Written in 200BC, Sun Tzu provides a detailed account of various considerations for an army preparing for war, from military arrangement, terrain, positioning, leadership and emotions. This quote from the first chapter resonated most with me: ""All warfare is based on deception."" Why else would people needlessly kill themselves?"
"936",935,"naseer yahya","need to read in order to be socially literate at least; i read it a few times over; wish i could understand chinese to not have to rely on the translation"
"937",936,"Gio Ravalico","Basically a handbook on how to be a general. A little dry at times, but very informative. Some tenets still apply today in business and relationships. "
"938",937,"Siim","Päris hea, mul oli mingi kommentaaridega versioon, mis tegi natuke segaseks."
"940",939,"Salymar","This book was recommended by my Professor in World Politics.I found this book fascinating because it unlocks the secret behind the strategies of power on different wars fought in the world.Sun Tzu emphasized the importance of positioning in military strategy. The decision to position an army must be based on both objective conditions in the physical environment and the subjective beliefs of other, competitive actors in that environment. He thought that strategy was not planning in the sense of working through an established list, but rather that it requires quick and appropriate responses to changing conditions. Planning works in a controlled environment; but in a changing environment, competing plans collide, creating unexpected situations."
"941",940,"Eddie","Not necessarily a sit down and read-through kind of book but there's some definite wisdom in these pages."
"943",942,"Quinn da Matta","Interesting read - easy to replace ""war"" and ""battleground"" with any type of confrontation; both professional or personal."
"949",948,"Anti Wibawa","to create strategies in life. easy to understand. but didn't finished reading it."
"954",953,"Alen","everyday I wage war. everyday."
"955",954,"Mervyn Cartwright","Bit disappointing"
"959",958,"Bruno Cunha","Estou num momento no qual quero ler os livros best sellers de administração, estratégia, liderança, essas coisas, e decidi ler Sun Tzu. O livro é bem curto. Essa versão que peguei tem letras bem grandes e a descrição de cada capítulo é um tanto sucinta. Sinceramente não gostei tanto do livro. Li pensando estar numa China de 2000 anos A.C., naquele tempo no qual os generais e samurais reinavam na guerra, como os filmes desse gênero que passam nos cinemas. Algumas passagens são bem óbias como as dicas de que é melhor evitar a guerra ou que quanto mais longa pior. Isso nós podemos traduzir para as relações de liderança do mundo corporativo, mas dicas como não subir um vale para atacar um inimigo ou evitar pântanos no meio do caminho ficam um pouco difíceis de tentar decifrar.Não consegui traduzir muitas “dicas” nessa leitura. Talvez por ter lido como lazer e não ter parado para refletir nesses “ensinamentos”. Dica: nessa versão, ao final do livro, tem algumas páginas para você fazer as suas anotações. Se eu tivesse visto isso antes e lido mais calmamente, talvez escrevesse esse post com mais reflexões preciosas e ensinamentos mais profundos… quem sabe na próxima leitura."
"961",960,"Lisa Dorenkamp","I am reading the Borders e-book version. Very interesting so far!----------------------Updated review: I would have preferred the version that did not contain constant explanation and commentary included within the main text. It distracts from the flow of the points. Still very interesting though..."
"964",963,"Suzie Toumeh","This seemed to me like reading a tutorial for some strategy video game like Crusader Kings II or Samurai Warriors. It absolutely has no benefit to the modern world person other than being a fun way to waste time - I think I used to read little quotes from it in Tropico 4's loading screens..speaking of Samurai Warriorshttps://www.youtube.com/watch?v=VAUk3...Man... Strategy games are awesome."
"966",965,"Kenneth Donovan","interesting to see how little things have changed in regards to the treatment of others and achievment of goals."
"967",966,"Eric Molinar","kinda hard to read. Not really what I expected from other readers."
"968",967,"Elli","Sehr japanisch... einerseits sicherlich sehr gut anwendbare Tipps, andererseits irgendwie doch sehr östliche Weisheiten mit ungewohntem Stil. Das wäre imho eher ein Buch zum diskutieren in einer Lesegruppe und einer Schule, mir fehlt einfach das Hintergrundwissen um es wirklich zu verstehen."
