"","X","user","review"
"1",0,"Alisha G","I found the ideas interesting, despite my relative disinterestedness in the subject. My 'definitive English translation', however, was full of typos and that drove me crazy. "
"2",1,"Ivy Zhang","i give ratng 3 is mainly because this is not the typical book i would like to read Mr Sun Tze had lot of interesting points writte in the book. it is a very famous chinese army book. I knew the name of the book and the author by heart when studying history at school. however I had never got interests to read such book back then. I saw the English version of this book at a randomly opportunity, I had chance finally to read it. the books is mainly around topics of how to plan and win a war in different situations. for me, Mr Sun Tzu is actually a pioneer of psychologist. he emphasis how important morals plays in the war. how commander should take advantage of external factors and build up morals of militaries. he talked about winning a war does not mean victory and true victory is winning with easy. there are many interesting physiological points which can br easily applied to any other situations other than war. I can tell why this book is still being read by people nowadays."
"4",3,"Tim Weakley","Marginally more enjoyable than The Prince. I still found this to be basically a collection of common sense advice from the military perspective. It must have been revolutionary when it was first collected but there were very few true insights to my way of thinking."
"5",4,"Rafael Victoria","Es un libro que utilizando las estrategias de guerra podemos usar esas mismas estrategias en los negocios."
"11",10,"Omran NAJJAR","مجموعة من عمليات التحليل الاسترتيجي والمفيدة"
"15",14,"Kelanth","Il libro è sicuramente interessante e degno dio lettura, ma per chi come me non è un poco studioso o informato di filosofia cinese troverà, alcune lacune di comprensione nella lettura.Se teniamo conto che questo libro è stato scritto duemilacinquecento anni fa, possiamo renderci conto del valore di questo testo che è ancora letto tutt'oggi. Quanti lo sono?La narrazione si presta a varie interpretazioni, sia ad un livello di base, che tratta sistematicamente di tecniche militari, sia ad un livello più metaforico ed ampio che è il pensiero di Sun Tzu di come affrontare la vita di tutti i giorni. In questo livello di lettura si possono trarre ""numerose pillole di vita"", ma probabilmente l'insegnamento principe è che ""la miglior battaglia è quella che vinciamo senza combattere"". Da leggere, ma per una vera comprensione del testo, occorre una bella infarinatura di filosofia orientale.http://kelanthsblog.blogspot.com/"
"16",15,"ron btdtbttsawio","A very short and easy to read booklet."
"18",17,"Joel Weinert","“Ultimate excellence lies not in winning every battle but in defeating the enemy without ever fighting.” A nice, though light, translation of the classic. Some historical background is included, but my preference is for more detail and discussion of possible meanings."
"20",19,"Anand Kumar","Just finished reading this book...It's interesting to know about the tactics used and to use in war. But the content mentioned here might help in addressing conflicts or working with corporate competition.It's a good book to read, and nice one if you like to apply it with your current challenges dealing with conflict or competitive world to win.Happy Reading!!!"
"24",23,"Melody","Very interesting. Great wisdom and strategy. No surprise it is required reading at the military academies."
"29",28,"Arielle","Overrated"
"31",30,"Philippe Malzieu","This text is regarded as one of the reference in strategies (with Clausewitz for example). He was written during the time of the combatants kingdoms. There, it was important to be the more effective strategically as possible. We have in France the traduction of the jesuit Amiot. After the Father Ricci who finished his life as Emperor advisor (his tomb in in an university garden in Beijin), many jesuits had gone in China. The book is divided into 13 chapters beginning all with ""Master Sun said."" All is articulated around an only goal, to overcome and beat the enemy, It is necessary to win about is the used ways. We are not in delicacy. One lies, one cheating one trick.That does not disturb me if it is for acts of war. The top of art of the war is to subject the enemy without crossing iron. So the importance of spying.But this book wants to be more than that: a treaty of life. He wants to be a metaphysic manual. Not to see in others his own image is not acceptable. One should not give to this text a universal range. It is only a treaty on the way of gaining a war. Not other.Point."
"33",32,"Vanesa","I wanted more...I found it common sense. Or is my ""common sense"" not so common?, perhaps. I can't tell. But, indeed, I wanted more and that' a good thing."
"35",34,"Jinu","It's all about war and certain aspects of it that I did not enjoy like bribing spies. But it also talks about using force only when needed and best way is when the enemy surrenders. Overall it was a different reading experience for me and war is all about strategy be it with managing resources and army and psychologically manipulating the enemy. The setting of this book is ancient and limited to attack on land."
"38",37,"Gene Leo","Like it or hate it, you have to admit - this is one of the manliest books ever written. Each statement is filled with so much confidence, power and arrogance I had a thick beard by the time I finished reading it. "
"44",43,"Chad Sayban","“All warfare is based on deception.”“The art of war is of vital importance to the State. It is a matter of life and death, a road either to safety or to ruin. Hence it is a subject of inquiry which can on no account be neglected.”Born in the fifth century B.C., Sun Wu (Sun Tzu was an honorary title) wrote the quintessential rulebook for warfare, known today as Art of War. While the often quoted lines of Sun Tzu are as lyrical as poetry, it was written 2,500 years ago with the singular purpose of codifying the essential requirements for generals and soldiers to be victorious on the battlefield. Even today, his treatise on war is studied by not just military officers, but business leaders and politicians as a roadmap to victory.While most of us have heard of Art of War and have no doubt read many of the catchy anecdotes that populate Sun Tzu’s writing, I dare say very few people have actually read the work from start to finish. While the version I read was about 300 pages, less than 50 pages make up the actual translated writings of Sun Tzu. That text is preceded by a rather informative historical overview of the life of Sun Wu – of which only a few documented facts are known. More importantly, the introduction does a good job of establishing the climate that Sun Tzu lived in within what we now know as China. Frankly, I found this to be the best and most informative part of the text.Sun Tzu’s actual text is written as a series of individual statements that appear to have been cobbled together. I’m unsure if this is the result of how the work was translated or if the original text was pieced together from scattered writings, but it gives the writing a disjointed feel. However, I can accept this limitation given that it was written as a technical document more than two millennia ago in a different language. From a content perspective, there are many well-known phrases that ring true today. But while the general philosophies are what we remember, the lion’s share of his text details very specific situations and strategies for warfare of that era. The remainder of the book – more than half of it in fact – is a detailed breakdown of individual passages from Sun Tzu’s text, expanded upon and placed into the context of more modern battles throughout history. This was the most problematic portion of the book because in a lot of cases it was a very tenuous leap to connect the specific tactics of some of the cited battles to the specific situations Sun Tzu wrote about. Sun Tzu’s text is just ambiguous enough that almost anything can be read into some of the passages. It was more wishful thinking than established doctrine that associated some of the examples to his writing. And while Art of War may include many philosophical musings that are usable today, most of Sun Tzu’s writing about specific military tactics– while educational from a historical perspective – are wildly obsolete in the modern world. As a fascinating historical document that illustrates the thinking and strategy of an era where little has survived the ravages of time, Art of War is an invaluable resource. But as a current day treatise on the conduct of war and competitive strategy, it is really lacks concrete value. Anecdotes aside, I’m pretty sure that no modern standing army or corporate think-tank is sending its best and brightest into the trenches with nothing but Sun Tzu’s writing even though some believe Art of War is the end-all, be-all of strategic thought. It would be a little like arguing before the Supreme Court with no other legal education outside of reading a lot of John Grisham novels. I think Art of War is a valuable work, but it has achieved a sort of cult following in certain circles that outstrips its actual contribution to strategy. The authors of this translation have gone overboard in assigning value to his teaching – value that can’t really be substantiated. Is it an important historical document? Absolutely. Is it the cornerstone of all of the strategic thought that exists today? Not hardly. While Sun Tzu was in fact a brilliant strategist and philosopher, Art of War wasn’t even translated into a western language until 1772 (French) and 1905 (English). I’m pretty sure most of these strategies had been discovered and utilized by western armies long before then. Perhaps the most important thing that is lost in the supplementation of Art of War is Sun Tzu’s primary motivation for writing his treatise. While his text is held up as the guide to war, this translation does hit on a key philosophy – it was peace that Sun Tzu was most interested in. He wanted his countrymen to be able to protect themselves and allow for the citizens to live in peace, not war. All you have to read for proof of that is what I think is the most important sentence he wrote:“There is no instance of a country having benefited from prolonged warfare.”Amen to that."
"45",44,"K.M. Weiland","Its depth is found in its simplicity. But I can’t say that I found it life changing. The famous quote about “knowing your enemy” was the best bit. Would have been much better without the translator’s constant interpolation of footnotes. Easily two-thirds of the book was the editor talking vs. Sun Tzu."
"54",53,"Angie","I found reading the commentary after the main text to be very helpful."
"56",55,"Judy","Worth reading the introduction."
"57",56,"Muhammad Fadel","This book contains Sun Tzu writings about strategy in war. It was quite detailed, and sometimes poetic.I was very enthusiast to read the at first, but diminished as I know what Sun Tzu Said won't be applied in my daily life really soon. Might consider to read it again one day when those knowledge really fits with me."
"59",58,"adrianoates","Clear thought"
"61",60,"Fatemeh Mostofi","intersting strategies gathered in a short book (y)"
"62",61,"Roxy Wilde","2015 Reading Challenge*A book more than 100 years oldA book that was originally written in a different language"
"63",62,"André Alves","Um livro que demonstra o pensamento estratégico do que era a arte de fazer a guerra para Sun Tzu. Sem notas de apoio é um livro dificil de compreender até porque a tradução do mandarim para línguas ocidentais tem muitas expressões que não apresentam ligação.Interessante mas não é um livro de leitura comum e por isso ao fim de um tempo torna-se um livro um pouco pesado apesar de não ser muito extenso."
"64",63,"Manikandan","May be I did not read it properly. May be I have to read it again. Did not get much from the book!"
"66",65,"Senake Atureliya","Highly relevant even today, but I wish it wasn't. Humanity needs to move on...with a Compopoly."
"67",66,"Peter E.  Frangel","The information found here is so intricately interweaved within our present and past culture--through media, and business, and politics--that most of it now seems like common knowledge. Sort of like the Ten Commandments. The language, however, is quite beautiful. “Let your plans be dark and impenetrable as night, and when you move, fall like a thunderbolt.” “If you know neither the enemy nor yourself, you will succumb in every battle.” “The supreme art of war is to subdue the enemy without fighting.”"
"73",72,"Jeff Wilson","Good content but terrible audio presentation. Cheesy music, over acted narration, and so on. I do enjoy proverbs and I loved several of the tactics and approaches from old world Asia."
"74",73,"Stan","It seems that everyone is quoting this book, from Movies and TV shows to preachers to movie stars to the working class as if the book has some scared ancient knowledge. Most of the book seems to be common sense like attack if you out number your opponent 5 to 1, feeding and equipping army cost money and so on. Yet I am often reminded that common sense is often a rare quality just look at our political leaders. So while this book may state the obvious it is still fullof advice that I wish our leaders would follow."
"79",78,"Stanley Lee","I only found it applicable when I made everything into a metaphor which I'm sure is far away from the original intent of it. This was something of an exercise in reader theory for me."
"80",79,"Adam Petty","Historically, a very influential book, but not particularly relevant to me."
"82",81,"Fernanda Vega","Conociendo este manualSoy una persona q no cree en la violencia, la guerra me asquea. Sin embargo considero que estos principios se pueden utilizar igualmente en enfrentamientos ideológicos.Unos cuantos errores de ortografía y sintaxis."
"83",82,"James Hatton","The core text, ""The Art of War"", is a classic in world history. It is still relevant because Asian nations still rely on its principles. This translation is accompanied by a lot of contemporaneous history. It's very interesting and a very worthwhile read."
"84",83,"N.W. Harris","I wish every politician that has a vote on what our military does overseas would read this. Amazing how many simple rules they break and this book accurately predicts the result of their follies. Also a good book for writers to draw upon."
"85",84,"Aleksiel","The book is very useful to anyone who wants to grasp the foundations of warfare quickly. Of course, it can't be used to base an entire modern military strategy since technology has changed so much, but the same basic rules still apply. It's a great read for heroic/epic fantasy or pre-modern military fiction novels fans."
"86",85,"Takudzwa","good"
"93",92,"Jerry","Quite a nice book about how not to wage war for nothing. Of course, the lessons need to be applied and although the military equipment and battles have changed through times, many of Sun Tzu's advice can still be taken into account today. Even in daily life, when you struggle with something or someone. He tells us how to appear weak when we are strong, and strong when we are weak. He tells us how we must know our enemy as well as ourselves in order to end up victorious. And so on, and so on. It's truly interesting, besides, we can easily compare the way he describes war with the way we struggle with some people, The Art of War is a masterpiece that teaches how to become a war mastermind."
"95",94,"Daniel Ribera","I recently accessed a couple of lists of recommended books on the topic of leadership. The Art of War by Sun Tzu was on one such list. Being a short book I decided to read it. All I will say is that if this is the image that some have of the task of leadership we are in big trouble. I understand the wisdom of planning and action. Those are two take-aways that I can and do adopt. However, if leadership is viewed as being equivalent to a military encounter with a hostile enemy then I need to part company with those who follow such a idea of leadership.Regarding Sun Tzu, the 5th/6th century BC, Chinese, military genius, I am impressed. As a Westerner, I am largely ignorant of the knowledge and achievements extant in the East five centuries before Christ. This little book helped to correct my lack of knowledge. Sun Tzu is an experienced, military leader, strategist, and even teacher. He has insight into the psychology of his soldiers, the advantages of various terrain, fighting in various circumstances and situations, and even the advantage of dealing with spies.Thank you, Sun Tzu for teaching me, so now I will know to have the hill over my right shoulder in battle, and not to despair when I am pinned down. I'll try to find peaceful applications of your advice as I have opportunity to lead."
"98",97,"Lloyd K","A most interesting read, with practical application still possible today (in essence) in innumerable modern situations outside of warfare and armed conflict. Well worth reading (IMHO)."
"100",99,"Chuck Leduc","The content was interesting, but this translation was difficult to follow."
"101",100,"حاتم عاشور","هي تكتيكات حربية قديمة ولكنها يمكن إسقاطها والاستفادة منهافي حالات اليوم ..حتى برأيي يمكن الاستفادة من حكمة بعضها في التعامل اليومي مع الشخصيات المختلفة وفي مجالات عديدة. بما أنه نص صيني قديم مترجم .. يفتقد في بعض الأحيان للترابط أو حتى يكون هنالك تكرار. ما بين فهم الذات والعدو والتعامل مع ساحة المعركة قبل وخلال وبعد .. سوف تشعر بعمق ما يتحدث عنه."
"102",101,"Bart-Jan","After having read quite some books on negotiation, this one couldn't be missed. An interesting read, a body of knowledge that indeed has served as a foundation for many of our daily and military operation. I'm not at all surprised the Chinese have been a major world force ever since.."
"104",103,"Noel Burke","I finally finished this book. I thought I would read it on my phone during my deployment and that did not happen. So I listened to it on my iPod instead. What a smart guy!"
"105",104,"Vinicius Menezes","Good book commented chapter-by-chapter by a modern military Chinese general. At the end of the same general draws insights and his interpretations on how Sun Tzu ""rules"" are to be viewed/used."
"107",106,"Afsar Ali","the book was written 2000 years ago and it is still valid for modern world metaphorically. It was a good read . Recommended "
"116",115,"Balaji S","The thought process with which Sun Tzu explains about the real qualities of the General is really amazing. This book and the contents are applicable to every walk of life even in today's competitive world not only war. Good to read such a old book."
"121",120,"Limner Locin","To win without fighting is not simply ""best""; it is essential, and cannot be conceded."
"122",121,"Fahad Naeem","His art of war is actually art of living. An above average book."
"123",122,"Janette","The Art of War, itself, not so bad. The constant repetition of interpretation after interpretation and analysis after analysis of the same things...that got old. I would read the original text again, but skip the rest. I have a brain, I don't need the same thing explained to me 10 times."
"124",123,"Ali","a polititian's bible... gets one to understand these guys"
"126",125,"Ala","So in war, the way is to avoid what is strong and to strike at what is weak."
"128",127,"Kristijan","Hm... evo čekao sam da mi se malo stalože misli povodom ove knjige... ali ostajem pri tri zvezdice!Da, da, da - znam šta bi neki od vas rekli i slažem se - za ono vreme kada je knjiga napisana ona je stvarno odlična kao traktat o ratovanju i puna raznih saveta.Međutim, sa ovih trideset i nešto godina, sa ""iskustvom"" iz raznih lekcija koje se nalaze u istorijskim udžbenicima, kao i sa ""iskustvom"" iz raznih drugih knjiga ova knjiga me je ipak ostavila razočaranim i ravnodušnim.Možda bi ocena bila bolja da sam je pročitao sa manje godina i manje iskustva."
"131",130,"Parker Donat","Great and insightful book if you read it to be applied to public relations, politics or any campaigning. I enjoyed the great quotes! (Pay attention because they can be applied to nearly anything.) Best of all was the ""Uses of Spies"" chapter. Sadly, I'll probably never pick this book up again other than reading my notes and highlights. "
"134",133,"C.B.","Interesting....if you're in the mood for this sort of reading. It's a very manly book that not everybody can read. If you're a business man/woman in a competitive world, this book is meant for you."
"136",135,"Mike Hale","If I turned this in in english class, I'm pretty sure I would get a poor grade because I didn't follow MLA standards, but I'll let it slide this time Sun Tzu!"
"137",136,"Regina Doman","One of those books I'll have to re-read sometime..."
"138",137,"Natasha Primaditta","Finished with the book, I still wanted to retain my previous comment about the book. I said before that reading this book reminds me of a business book for leaders and managers alike. Why? Simply because it contains a somewhat step-by-step how to war right from preparation period to actually waging the war. In the world of business or even the daily life, there were many encounters with both your allies and foes, positioning yourself to gain the most from it sometimes kinda war like. Assessing the situations, managing resources, laying out plans, and controlling the fields as a leader, both to your surrounding and yourself needs an artful approaches for your internal purposes. I like the old wisdoms that on some part still relevant nowadays intertwined with Chinese virtues. Such as: ""While speed may sometimes be injudicious, tardiness can never be anything but foolish.""""If you know your enemy and know yourself, you need not fear the result of a hundred battles. If you know yourself but not the enemy, for every victory gained you will also suffer a defeat. If you know neither the enemy nor yourself, you will succumb in every battle.The thing that really bugs me was the commentators that's numerous and arguing without clear conclusions of Sun Tzu's principles. That's also means that each of his principles can be translated as reader see fit when the commentators' comments didn't help on making the principles as a fixed and clearly defined ones."
"142",141,"Evan","This is a different version that the one I first read. I dont remember liking this book as much as the first edition I read, but I will probably try the B&N Collectors Library that combines ""Art of War"" with ""The Prince"" next. What I didnt like was all the history the author includes, just didnt interest me. I Just wanted the Sun Tzu teachings/quotes."
"143",142,"Denise Blumenfeld De Amiel","La versión que me descargué gratis en pdf tiene demasiados mensajes religiosos católicos ente párrafos del libro.El libro está bien.... lástima esos mges. En el medio"
"146",145,"Champ T.","Worth reading, language a little hard to get through."
"151",150,"Radit malasmembaca","if you're a peace-wanting guy, bad book... a great book only when you have a purpose on reading it... use it as a guide to play a war game..."
"152",151,"Jeff Derosa","I read Thomas Cleary's translation. This reads like a book of aphorisms. I suspect when applied as a metaphor to our respective careers, misinterpretation of these lessons can do harm. I can also see how thorough study of Sun Tzu's teachings and proper application can improve any person's leadership abilities. For me, I feel this book has helped me as a voter when faced with acts of war/terrors. It has also helped me better form opinions about world history. First, as a voter, this book will help me carefully consider going to war after dark moments such as terrorism. Sun Tzu warns against going to war based off emotion. I'm thankful for this perspective. As a student of history, I find reading this book goes well paired with the Sun Tzu specific ""Military Documentary"" produced by the History channel. This documentary does a great job relating this book's teachings to the Civil War, WWII, and Vietnam - both successes and failures to follow these lessons. "
"154",153,"Conchita Masci","As a political science major I can't believe it took me so long to read this book. As a basis for all political activity it is succinct in what is needed to bring about change. The use of this book as a tool for literal wat is evident but my surprise is in how it can be used in everyday life and work situations. :) I guess that is why you see so many spin offs of the book. "
