"","X","user","review"
"6",5,"Alissa Nelson","The advice is sound (it's all basically what you learn about trust building and change management in social work), but the writing is horrible and corny and so very very sexist in the edition I read. "
"26",25,"Peyman","با بعضي از مظالب اين كتاب مخالفم، ولي در كل كتاب خيلي خوبي هستش. چند سال پيش اين كتاب را خوانده بودم و با خواندن اين كتاب تحولات زيادي در خودم ايجاد كردم. "
"32",31,"Michael A","I read about half of this book before giving up (almost in disgust). I suspect I should not be all that surprised given the author's deliberate name change to try and associate himself with Andrew Carnegie in order to market himself and boost his own popularity. That should have been a huge red flag to begin with.This book is essential reading if you are a politician or salesman and necessarily have to stay on the good side of people most of the time. But I'm willing to bet that most of us don't fall into that kind of category and need more than the advice this book gives to get through our daily lives. Life is far too complex for a book like this to address in any substantive way in my opinion. Further, this book is fundamentally very dishonest in the way it works. It will take some time to explain, but I think it is worth it so that you at least know what you are getting into when you crack open this self-help tome.First, a lot of the advice in this book is perhaps age old wisdom from various sources. He does not hide this fact and still the book has sold millions of copies. I guess as a reading public we like being lectured in morality/manners because this book is no different than a series of Sunday sermons mostly on the same themes. Just to illustrate, here are the ""core"" bits of advice you'll find in the book:The Big Three: ""Don't criticize, condemn, or complain."" ""Give honest and sincere appreciation."" ""Arouse in the other person an eager want.""The Mid-Rank Six: ""Become genuinely interest in other people."" ""Smile."" ""Remember that a person's name is to that person the sweetest and most important sound in any language."" ""Be a good listener. Encourage others to talk about themselves."" ""Talk in terms of the other person's interests."" ""Make the other person feel important -- and do it sincerely.""The Lower-Class Twelve:""The only way to get the best of an argument is to avoid it.""""Show respect for the other person's opinions. Never say, ""You're wrong.""""""If you are wrong, admit it quickly and emphatically.""""Begin in a friendly way.""""Get the other person saying ""yes, yes"" immediately.""""Let the other person do a great deal of the talking.""""Let the other person feel that the idea is his or hers.""""Try honestly to see things from the other person's point of view.""""Be sympathetic with the other person's ideas and desires.""""Appeal to the nobler motives.""""Dramatize your ideas.""""Throw down a challenge.""9 Ways to Be a Leader:""Begin with praise and honest appreciation.""""Call attention to people's mistakes indirectly.""""Talk about your own mistakes before criticizing the other person.""""Ask questions instead of giving direct orders.""""Let the other person save face.""""Praise the slightest improvement and praise every improvement. Be ""hearty in your approbation and lavish in your praise.""""Give the other person a fine reputation to live up to.""""Use encouragement. Make the fault seem easy to correct.""""Make the other person happy about doing the thing you suggest.""Well, as much of a slog as that list might be, I just saved you from reading the book itself. The only thing you will find in the book not in this long comment is chapters that provide example after repetitive example of stories that exemplify those pieces of advice. Do you notice how some of these overlap or even mostly repeat themselves? Also, why are two or three stories based on famous people supposed to provide all the evidence we need to accept the advice? The man studied logic himself -- surely he knows about the fallacies of arguing based on tradition and based on ""authority figures."" It's not a good way to go about proving a point!Here's the thing, though, I recognize that a lot of this advice isn't bad to follow in public and I could be a better person, introspective cynic that I am at times, by taking such advice from time to time. When I am in the classroom, for example, I do try to practice a lot of these things and empathize with other students and colleagues because you do have to act in these ways sometimes to inspire or encourage in that setting. That's why I don't give it one star because it reminds me of that.That being said, I would find it very hard to be around people like this in my own personal life because the ideal person of this book, in Dale's imagination, is the social robot. This person would hardly speak, be far too polite, and be perhaps too attentive to the other person. Nor would this person really say much of consequence because he would be too busy not trying to rock the boat with you to really speak his or her mind. This is probably why I don't have many friends in the sense of this book's definition, but I'm okay with that. It would be a huge waste of time listening to folks I didn't really care for. I'm an introvert at heart and I don't like always being around other people.But I suppose my biggest beef with this book has to do with something entirely different-- here is yet another example of a writer/author not doing what he preaches. Why? This book is mostly filled with persuasion just to get you to take his point of view. Despite all those nice little bits of advice he tries to push, he about breaks every one of them based on his writing style. Here's a man who wants to lecture you, tell you how to act, tells you need to change and that you're wrong about your previous behavior, who doesn't respect your opinion, and so on. It's an odd thing to run into this so often in movies and books -- human beings really are self-centered I suppose. But, for a book that bases its content on being so respecting of other people, this author comes off as having about zero respect for the reader and THEN WANTS YOUR MONEY at the same time for the privilege of reading this book. Could this be any more patronizing?Bear in mind this is just my personal opinion and the book has obviously found an audience within the USA especially, but, if you read like me or think like me, I'd advise you to stay away from it -- and if you must read it, a simple way of doing so would simply be to take the key points from the summary above and putting it into a Word file or list for quick perusal. "
"63",62,"Douglas Echenique Zambrano ","Un libro dedicado a como ganar amigos e influir sobre la gente, o como ser pasivo y dejarte montar la pata por los demás, desde mi punto de vista el libro tiene muchos errores porque hay cosas en la vida que uno puede pasar, obviar, o no hacer nada para cambiarlos pero no puedes tomar un rol pasivo y dejar que todo el mundo te pisotee"
"67",66,"Denise Hogan","Basically good messages, though somewhat simplistic at times. I often felt that the suggestions to ""win friends and influence people"" were manipulative behaviors, worthy of a salesperson trying to make that sale. The author did remind me several times that sincere desire to want to make connections with people is needed, thereby counteracting the intention of manipulation. Since it was written in 1936, the language is somewhat quaint. For me, this made it more entertaining. I've always heard about this book and glad that I finally got around to reading it."
"86",85,"Rawan Al-Wazzan","Though I'm not a fan of self-help books, I decided to give this one a shot. Kinda wish I didn't!The author didn't present any new ideas -or in this case, tips. There weren't any 'aha moments' which I expected to find abundantly. I have to admit, I was a bit disappointed especially after reading all the book's positive reviews.Hope it serves its purpose to other readers even though it didn't with me. "
"120",119,"Rachel Gopal","I did not read the entire book nor was it my intention to. This was an assignment for philosophy where the task was to summarize, criticize and decide if the book was philosophically ethical (which it is not!).However, I did read the main points and all the tips of the book and it did not give bad advice. If your actual intention is to ""win friends and influence people"" it may not be of any help, but the tips are useful in terms of improving your social skills. "
"122",121,"Ashley Johnson","This book was very redundant and went over the same stuff over and over just kind of wording it differently. There were a million and one examples to back up the principles which was kind of annoying. I will say some of this stuff made sense, but I feel like it was also common sense. This would probably benefit someone who really struggles with positive social skills. I'm sure it could be a real gem for them! "
"132",131,"Luke Langley","Art of manliness listed. The book gives decent but obvious advice. It is long winded in telling simple points. Draws a fine line between 'influencing' and 'manipulating' people, but I think Carnegie was sincere in his efforts. "
"144",143,"Nizar Ch","ce livre dans quelques chapitres ne nous apprend pas à nous faire des amis mais plutôt à devenir des apprentis hypocrites et des lèche-bottes professionnels "
"170",169,"Virginia Varland","I want to appreciate this book for some of the timeless truths that it delivers but as a whole it just feels to fake, patronizing, and simplified for me to like."
"177",176,"Jeanny","Throughout the book I felt a sense of enragement and conflict. While Carnegie sets out to deliver the ultimate ""how-to"" guide in relationship building, he, in essence, draws a crippling image of humanity denouncing us all for being shallow, self-absorbed and judgmental. It's sad that we need to be taught to be human, and that genuine curiosity and compassion is twisted into manipulation."
"179",178,"Michael Greenwell","I enjoyed the anecdotes that season Dale Carnegie's How to Win Friends Influence People, they have a folksy charm from another era. However, I really wonder whether this book is that valuable. The anecdotes, however charming, have dated considerably, and often strike me as rather selfish despite the books continued claim that the suggested sentiments must ""come from the heart"". The principles that are put forward seem reasonable enough, but the book simply lays them out with only anecdotes to support them, which leaves me with little faith in the practical value of such sweeping suggestions."
"192",191,"Vegard Pettersen","TL;DR Read the summary of points on wiki instead, here: https://en.wikipedia.org/wiki/How_to_...The book is a bit outdated, and starts with the premise that if you show attention to others they will like you.It's superficial in that it does not address the differences between politeness and genuine friendships, it is way to wordy, and it struggles with trying to establish how actual relationships would be expected to form from politeness, as opposed to merely a set of aquaintances.Stopped reading at page 64, may get back to finishing it at some point when I am bored, as it has its good points and tidbits, but not enough to way up for its tediousness."
"222",221,"Marija Jure","I have read this book loooong ago and didn't enjoy. But some new people appeared in my surrounding who praised it so much that I decided to give another try after years. Book seemed soooo damn primitive, I had to put a lot of efforts to finish it. I didn't feel like I learned anything new when reading it first time and neither reading this time.The only reason I give this book two stars is because I understand it could be useful for: 1) salesmen (yes, definitely) 2) people who aren't familiar with any basic concepts of human communication.Otherwise it is only for those who want to exploit the friendship for the sake of any kind of gain.My own socialisation success probably comes just intuitively from the basics of education that I received from my family: be nice, thoughtful, considerate, supportive, educated and interesting person that You could have interesting conversations. Most important – genuine, if You want to have likeminded people around You. I can talk quite a lot because I got pretty dominant temper but still for me is important to be a good listener, so I am doing my best to be conscious and observe when people want to talk themselves. One doesn't have to agree on everything and all the time to have real friends, that's for sure! And don't forget that there's nothing more beautiful than a genuinely smiling face."
"240",239,"Angelo","Yet another book that is related to research I am doing for work. Dale Carnagie was known as Dale Carnagey until he changed the spelling of his name to that of the well known industrialist, Andrew Carnegie, in 1922. I wanted to read the original 1937 edition for historical purposes. Instead, I had to settle for an edition from the 1980s. Many of the allusions in the work are quite outdated--that's part of the fun of reading it. He clearly was focused on helping those in the business world, especially salesmen (and I mean MEN), become more successful. His advice reads like nothing but common sense to me. But apparently it is still much in demand (the latest edition was published in April 2007). I'd say to save your money, skip the book and follow the golden rule, which basically summarizes this book."
"241",240,"Rhonda","If you ever need a book to tell you how to change your personality for the better, this is it. Unfortunately, and perhaps my criticism is somewhat misplaced on the book itself, I find that most people are either generally friendly people and thus able to benefit readily from this advice or somewhat less than gregarious. It isn't that less gregarious people are incapable of profiting form this information, but that it appears, very often, a painful transition which they are unable to maintain for any length of time. This is the main reason this book is always worth revisiting, even if one intends to be a hermit crab."
"246",245,"Brandon Vanover","Kiss up. Feign interest. Tell others they are right even when they are wrong. A few of the nuggets of wisdom contained in this book. "
"256",255,"Jasmine","Couldn't finish it completely. Had a lot of good points, but I thought it was pretty obvious and self-explanatory. I just wrote down the main points and ideas to look at and think about for times when I feel like I want to work on being a better friend. "
"258",257,"Katie Henderson","The advice is nice: be kind to people, listen to them, make them feel important. It's just that it's all for this ultimate GOAL of getting rich. Yuck. The book is pretty fun to read, because he really was the first one to say all of it. Now the modern self-help business writers pretty much plagiarize what Dale Carnegie already wrote. Sorry Brian Tracy, you were 50 years too late.But I don't like Brian Tracy, and I don't like this either. I don't mind being told to be kind to people. But ughhhh, it's all for this self-serving purpose. It puts a bad taste in my mouth."
"266",265,"Ciara Garrett","This book is okay. I agree it would have revolutionary back in the early 19 century when it was written, but with so many books written on this topic I feel they have outdone this book. Credit where credit is due as the ideas contained within this book are where the books of today stemmed from. "
"269",268,"Eric Dykstra","Overall lots of good ideas, but just too little content for how many words there were. I found myself skipping sections because of how repetitive it was."
"272",271,"Conrad","After reading half the book I have concluded it's a how to manipulate and get away with being fake in hopes of achieving what you want at the cost of anyone and everybody else.....not impressed to say the least"
"274",273,"Rob Hunsicker","I totally feel influenced and befriended by people who condescendingly use my name thirty times in a two-minute conversation. "
"278",277,"Voidal","The book was egh, ok. But the book pretty much enlists obvious things that whoever listened to their parents should be able to do well in life."
"288",287,"Chris Via","For those who haven't read it: There's a main point (or imperative) at the end of every chapter, and a corresponding rollup at the end of each section. For those with common sense and intuition, you may wish to simply read through these lists, as each chapter is simply packed with quaint stories that illuminate the points, but that (for me) don't really elevate the book above a collection of good reminders."
"289",288,"Emeline","The book was fine and interesting but very dated. I'd call this more of an etiquette book: Carnegie puts emphasis on what would be called manners (remembering people, asking about them etc..). To be honest, this is all good, but won't give you any friends, only make you a doormat, and you might soon find that people flock to you to tell you about themselves, and walk away. So you'll be blessed with impeccable manners, but honestly I don't know anyone who gives importance to manners nowadays, unless you frequent Texan country clubs.He illustrates his points with examples, but they are very vague and repetitive, and I found myself doubting the veracity of more than half of them. The language used is very ""turn of the century"" and I doubt that some of the letters sent by Carnegie's students in order to resolve conflicts of interests would do any good nowadays.I'd say the book is useful in keeping friends and influencing people once you have already reached a leadership role."
"290",289,"Despoina","This book will teach you how to ""make friends quickly and easily"". Creepy... Worth reading for its eloquence and the vintage feel though!"
"301",300,"Alyssa Siefert","If you get in an argument, the best way out is to say 'Let's Google it'"
"303",302,"iyan dhiannia","a baca buku ini karena pinjeman dari kaka a, n dia nyaranin buat ngebacana...a baca sekilas aja nda semua...point""nya maksduna sebenere buku ini baguus buat kepribadian cuma masalahna buku ini terkesan sangat beroreintasi pada kehidupan dunia aja "
"305",304,"Jody Hultman","Should be called, ""How to Cave in Every Situation and Remain Spineless."" At the very least, not impressive. If I have tot say something nice, I'd say that there are a few good pointers in here that work when applicable, but not in every-day dealings and constant conversations with people. When dealing with peers, friends, and subordinates, I'm not a fan of placing flattery, sincere or not, in front of constructive criticism. Criticism is more well-received when direct and not coated in sugar. Respect is earned and not normally earned via politics and fluff- which is the majority of this book's composition."
"308",307,"Dev Nithiavel","This book is a sugar-coated candy that when taken excessively, could end up in diabetes. Maybe its useful if you're into sales. You can't use this like a bible as what some people claim. It's too superficial. The world is a much tougher place and by strictly following the tips in this book, you could end up miserable. Of course there are some good points here and there but, that's it. Just have a quick read to see what's so great about this overated book. And put it aside. This complicated world needs much better self-help books."
"312",311,"Marks54","This book presents one of the classic statements of popular psychology oriented around positive self-image, self reliance, and cooperative relationships with others. It is one of the most popular and influential books of its type ever and provided the foundations for contemporary self-help celebrities, such as Oprah Winfrey, as well as much of current motivational and organizational psychology that one finds in current business school curricula.What to make of it? I tend to side with the critics, who are numerous. It is difficult to argue with the basic points of the book, taken at a surface level. Most people enjoy being respected, agreed with, and successful. Confidence and self-reliance are no doubt important personal characteristics in personal success. Many people do not enjoy conflict or being disagreed with and would prefer instead cooperative relations with others. OK, but so what?The problem comes once it is realized that Carnegie is highlighting an ambivalence that is inherent in many of our social relationships. On the one hand, we can interact with people on their own terms and without expectations of obligations, duties, or norms of reciprocity. We can deal with and respect people as they are. On the other hand, however, much of what we do in social life involves either trying to accomplish something through other people or having other people trying to use us to accomplish something of importance to them. In trying to balance these two aspects of social relations, most of us become aware of the need to balance. We do not usually treat commercial relationships as close friends. We do not draw up elaborate performance-based contracts with loved ones such as family members. The problem is that people who expect to be treated as independent persons do not appreciate being used by others for some personal end. It is conceptually difficult to see how someone can be both taken authentically and respected as a person while at the same time being viewed as an agent for someone else. Family members and loved ones do not like to be used. Commercial partners do not appreciate being treated as friends when more immediate personal goals were the basis for interactions.Many adults learn to balance these differing perspectives towards others. Sometimes we treat others at arms length while at other times friendships can develop. Carnegie's classic work calls on the reader to both treat people on their own terms and also to attempt to influence them to get their cooperation in attaining one's objectives. Without more specification of how and where to balance, however, the book becomes a more cynical effort to redefine the problem of positive social relations in the form of a solution -- in order to influence people and get your way, treat them authentically. The rub, of course, is how to go about doing this. It is akin to arguing that the solution to poverty is easy -- just get some money!The faux sincerity and false positivity in the service of influencing others come across as phony and manipulative after a while. This recalls another old maxim - if something seems to good to be true, it probably is too good to be true. The oversimplified examples and testimonials also get old in a hurry. The reduction of large business enterprises and their managers to a series of positive work interactions with employees is simplistic at well. The details matter, individual skills matter, industry structures matter, history matters. It is nice to imagine that a positive attitude can conquer all and bring one riches. That lets a lot of other factors off the hook for explaining success or failure. But wishing it is so does not make it so. The more I read it, the more it sounds like a text on manipulation and less like an industrial manual."
"327",326,"Aaron Lord","Not sure it lives up to the hype. Could be reduced by 67% by removing silly redundant stories."
"328",327,"Anita Byrne","I read this when I graduated from cosmetology school at age 22 or so. It was helpful to me because I needed so much work in the area of personality development and social skills.My dad liked the book because it made him more wary of tactics of salesmen."
"351",350,"Ruri Gokou","The title is highly misleading. The situations and advice that the author gives is fine, but it seems more geared for a salesperson. It's about how to win business partners than any real lasting friendships. Don't get me wrong. There is some good advice in here but only about half of it seemed very real and applicable in my life. Furthermore this book needs to be updated with situations today. The examples given aren't fit for this day and age. Like the one about the old woman giving some young guy a car because he showed some interest in her old house. That in particular stuck in my mind as ridiculous. This book was so-so. I think the advice and principles are fine but it needs better examples to go with them. I don't see how it gets the high praise that it does. "
"383",382,"Candy Boisvert","Meh. Next."
"386",385,"D","This book was good, but there was nothing groundbreaking or out of the ordinary in here that I haven't already seen in other books. Great intro for people who are not emotionally intelligent. This would be great for a sociopath who doesn't know how to relate to people and wants to at least feign it."
"393",392,"Dana Jeri Maier","I listened to about half of this. Too sanctimonious to finish. "
"396",395,"Suzan Lauder","I didn't finish this book. It really annoyed me because it basically tells you how to suck up to people to get your own way. Carnegie people would argue against that, in fact, Carnegie himself is flabbergasted at one point in the book when someone makes that exact point to him. Sorry, but that's exactly how it reads to me."
"419",418,"Sarah Cv","Having read this book, you will look back on it and.... be unable to remember a single original thought. Mostly a lot of obvious sales garbage that you've probably already heard before."
"433",432,"Roberta","Most of the advices given by the author is a matter of good education. And even if it is a good idea to repeat them they are not very helpful. Some examples are good and applicable in other situations but most of them are not."
"434",433,"Esther Greenwood","this book made me so angry."
