"","X","user","review"
"439",438,"Alice","Okay, can't say I really learned much."
"445",444,"Emilia","It has good info on how to talk people but it's kinda boring"
"461",460,"Sripathi","was good to read but.......nothing really worked ???"
"472",471,"Brian Virtue","brilliant"
"484",483,"Marla","I'd like to say that the book helped, but what made me finish the book are the samples/short stories inserted between Carnegie's reiteration that you need to think of others' wants first prior your own and that you must control your temper. The way the book was written may have been better effective on a seminar rather than in a book. The reiteration was a bit dragging."
"496",495,"Christian Dibblee","Books like this are always good to read from a self-improvement standpoint. It's good to have some working knowledge of how to make good impressions on people. I enjoyed Carnegie's admission that he was not promoting a ""bag of tricks"" but rather a total change of life to become less superficial and more sincere.That said, this book is dated and I didn't enjoy the way it was laid out. The never-ending story of anecdotes was entertaining to begin with, but quickly became tedious and repetitive. Also, these stories aren't as helpful in 2012. I found myself saying, ""If I said that, this person would think I'm creepy."" There are different habits of interaction in 2012 that I don't think this books accurately addresses. It does provide a decent baseline, but I would caution anyone against following it to the letter right now but being more situational. Being more sincere is necessary, but whether you speak in the ways he recommends might work out well or poorly depending on the situation."
"497",496,"Morgan (Turbo)","The book started out nice but towards the middle the examples started to wear me out and left me wishing for a more modern version of this book"
"502",501,"Taylor Storey","In my estimation this is the most influential/original of the self help books. Id include Norman Vincent peale's ""the power of positive thinking"" an Napoleon hill's ""think and grow rich"" along the same caliber. I think every good reader needs to read one of those books, and needs to be aware of the immense impact of this way of thinking throughout western culture (especially American). The problem is that beyond being aware of it, in my opinion it's pretty much bullshit. It's not helping our world to ""mind over matter"" everything. It makes for good sports stars, good business sellers, but bad product development. You can trick yourself into loving a bad life, and into thinking you are contributing to the world. Maybe you are, probably you aren't. I recommend reading the last 5 pages of Steve jobs' biography by Walter Isaacson to understand the better version of the idea presented in this book. Be a product person, not a sales person. No mind tricks, find the things that are good in the world. "
"538",537,"Torsten","another book that seems to be liked by most people. sadly I cannot share that. while some points he is making are interesting and helpful, most of the content here makes a old-fashioned and badly crafted impression on me."
"566",565,"Vlad Kitaynik","Pretty obvious things"
"571",570,"Hannah Dubrow","I felt that the principles were too basic for anyone who is naturally personable, friendly, or observant. Maybe it's because I read an edition from the 80s, but this book felt extremely dated and a bit obsolete. You'd do better to read a few articles off lifehacker.com. "
"588",587,"Fredrick Danysh","Dale Carnegie's proclaimed course on how to interact with people to achieve favorable ressults."
"592",591,"Ioannis Papagiannis","Two stars:-One for actually giving good advice.-The second for inventing clickbaiting. Or rather, ""readbaiting"".The book was clearly ahead of its time."
"606",605,"Sherise Alexis","There are very good points in here, but after awhile it felt quite repetitive, and I feel like it could have been said in fewer pages.If you're in a rush, it may be better to just list out the main point from each chapter and then read the chapters of the tips you don't ""get""."
"639",638,"Emmy","I read this book for the first time forty years ago. It was an eye opener then. It outlined what you need to do to become ""popular"" and to get what you want whether it was a job or a new dress!Forty years later I find it less than admirable. It may have been ""right"" then but ""wrong"" now due to the shift from conformity to personal expression and the fact that we no longer label different as wrong. Or it could simply be that it no longer acceptable to me personally. I think it depends on what you want to accomplish. If it is only the results that matter then then this is the perfect book. It helps you manipulate people in a polite way that makes it increasingly difficult for them to say no. My problem with this is that the real you gets buried deeper and deeper under layers of initially agreeing to what you actually oppose. I respect more someone who has the integrity to state their beliefs while respecting others'."
"655",654,"Melvin ","This book was okay. I wouldn't r read it again, but I would recommend to a used car salesman. It just seemed like it was full of tactics to get over on people. I might be being a little critical, but, I just believe in being me and accepted for what I am, and this book seems like it teaches you to manipulate people in a very small way."
"672",671,"Afshar","این کتاب از نظر من عالی عالی نیست و حتی شاید خوب هم نباشهبدک نیستولی اونموقع دید بازتری بهم داددر مورد بعضی خصلت های آدمها"
"677",676,"Laura Woodyard","I appreciated that this book looks at how to integrate oneself into rising into the socialite and social hierarchy of society because for a number of people in this world, that is of importance, and I can sit back, and understand their mindset, and understand what it is that they are seeking to achieve, and then go against the flow and do my own thing.What I didn't appreciate is that in some ways I felt like I was closing each chapter, and walking away feeling slimy and sleezy. I felt untrue to myself, and that I was being untruthful; that It wasn't about a mutual exchange but more about what can that person do for me, instead of respect for that person and just recognizing that they exist in more of a non-judgement sort of way, and that they might not be of the status quo, but they deserve rights just like every other human.I understand opinions will be formed... for example, in the case of current history (2015), with a number of incidents with terrorist attacks, people will not like or appreciate actions or the integrity of certain individuals or consider them disrespectful, aggressive, and a bit immature, such as ISIS.As I repeat, for me, it was more of the sort of aspect where I felt it lacked a sort of consideration, and it was more about fulfilling someone's personal vanity fair status quo, as opposed to living up to their own self, and value system. Maybe for others, that is their sort of value system: it is all about social status and the status quo. And that is fine with me. For me, I would rather seek honesty and character assets of people who appreciate and show a sense of loyalty, empathy and respect towards others (it doesn't have to be everyone), even if they have nothing to give in return especially from a financial sense, but rather based on commensalism or for the mutual benefit of experiencing the shared moment together. Maybe it is just a philosophy and way of life.There have been a few people I have crossed paths with in my life, who have recommended Dale Carnegie theory, and they were not so nice of people, more of the mean guys and girls, acting in a not so nice sort of way, manipulated people, to a degree that really turned me off to the whole process. And some were critical of labels and if that means that materialism and affluenza is what defines those friendships, than I don't want to be your friend."
"686",685,"Sam Backus","Too many stories about and quotes from rich white men. "
"707",706,"David Warner","Kinda shallow, but some good ideas. I like Stephen Covey's ""7 Habits of Highly Effective People"" better."
"710",709,"Raushawna","This is a good book to get you started with building relationships. It isn't that exciting and is a little dated in the examples it uses. It did help me learn more about President Lincoln and Dale Carneige. "
"718",717,"Farrukh","This book had variable effects on me. Initially i was so impressed as i found it very direct and straight forward message which we all know that are universally correct principles of life but we forget to apply them and those who remember stand out in the usual stream. But later on i found those rules out to be an effort directed towards book writing and not very practical as to make all of them part of your personality is either next to impossible or if done will transform you into a hypocrite of highest order. To what extent person can or should hide his inner feelings, sentiments and his soul? This is a question that comes to my mind after reaching three fourth of the total volume. I feel person must segregate people as per his/ her intimacy and must be very clear to whom to speak his/her heart out and with whom to remain diplomatic. He must not assume a diplomatic role across the board."
"722",721,"Eslam Elsheikh","It's interesting on how to understand and deal with people.. If you don't manage to work on yourself to begin with, and to be sincere it's going to a whole another direction."
"735",734,"Elias","A collection of anecdotes and stories to illustrate simple but effective principles for becoming a nicer person. I personally found it somewhat boring as a book to read front-to-back though, and didn't discover any very impressionable bits."
"745",744,"Alisa","Finally after owning the book for years, I read it. Did not find it helpful at all. "
"758",757,"name","decent read, but information seems a little stale. felt like a primer for salesmen."
"771",770,"Kaialaia","I enjoyed it very helpful"
"800",799,"David ","This was kind of a random book to read, but a friend had given it to me and I'll read pretty much anything. Overall it was a quick read as each chapter is mostly stories on top of stories that illustrate the principle. Most of the principles are rather common sense - for example, it is better to listen more and talk less. I found the book boring at times, the stories were almost unnecessary fluff to build up the point. It would be almost as beneficial to simply list the principles here and save anyone else the time in reading the book. Yes it is considered a classic and it certainly offers good teaching on how to be a friend to others but, to say it again, much of each chapter just seemed like fluff built around the principle to provide enough information for a book.I did appreciate how the author emphasized at times that these principles are not meant to be used to manipulate people in a bad way. At the same time, the author seemed very arrogant when he, in the introduction, recommended reading the book once quickly, again slower, and then carrying it around and returning to it often. As I read that my thought was that the author was full of himself, as if this book hold the key to life. Overall, this book is worth perusing at a bookstore and the principles are valuable in terms of learning how to interact with people. "
"813",812,"Brendan","You shouldn't have to read a book to know how to be nice to people"
"829",828,"Chantal Cjk","It should be called ""how others won friends and influenced people""."
"832",831,"Tama","I read this book for two reasons. One is that my mother-in-law always tells everyone they should read this book. (although I think her husband read the book, not her.) Second, there was a feed on LinkedIn where people were asked what book influenced them. Many were those you would suspect, i.e. Lean In, The Greatest Generation, etc. But one person wrote a glowing review of this book. I tried to find the latest edition, but am not truly sure I did. Although SOME of the concepts remain relative (people want to talk about themselves), others seem dated (""creating competition to improve productivity is infallable!"") Carnegie takes a ""father knows best' approach to communication, which may have worked when society committed to a job and hoped to stay in it for life, moving up in the company. Many of the examples were of ""the boss"" making a statement to employees to inspire them. In today's society, many of those statements may encourage the employee to look for a job in another company. Other examples were of family life. I believe there is a place for a book on this topic in today's society and would love to see an updated version. There is a newer book related to technology. I may check that out....some day!"
"838",837,"Adam Calhoun","ehbe nice to peopleeveryone's favorite person is themselvesetc"
"864",863,"Judith Wills","Meh! Don't take it too seriously! Certainly don't live your life by it else you risk David Brent-like tendencies to smarminess, but, there are some good bite-size principles in there, I guess. Easily digestible. Although all the back stories he tells to illustrate each point get a bit much."
"871",870,"Tracyrn03","Was a slow and hard to get into read but was able to get great information and notes to better understand my opinion of how I can be strong and lead to my own success."
"883",882,"Lyndon","Not sure what I expected but I was disappointed. Although the key points are valid the examples have aged. I felt like I was in the Great Gatsby but not in a good way. There are valid points and I think they are made adequately in the bullet point summaries after each section."
"887",886,"Mahrous","لو كنت قيمته منذ 5 سنوات عندما قرأته لكنت أعطيته خمس نجمات كاملة، ولكن بعد أن ازداد نضجي لسبب أو اخر، لا أتذكر منه غير أنه كتاب يدعوك لتملق الناس لكسبهم .. والتظاهر بغير ما تشعر ليكونوا أصدقائك، فاهتم بما يهتمون حتى وان لم تطق معه صبرا... ودعهم يتحدثون عن أنفسهم كثيرا وشجعهم على ذلك، فجميع البشر يحبون أنفسهم أكثر من الاخرين، وهو شيء مفهوم، ولكن ليس هكذا تبنى العلاقات الانسانية، وان بنيت على ذلك، كانت زائفة، وقصيرة الأجل"
"891",890,"Bilgin Ozkan","Should've been called 'How to be selfish and always look out for your own interests all the while manipulating people, but doing it sincerely'"
"895",894,"Kaung Myat Han","In my opinion, this book despite being a great American non-fiction classic sadly read like some cheesy manual for part-time cosmetic salesgirls written by some amateur high-school drop-out. I admire the man Dale Carnegie greatly but this book just wasn't my cup of tea. Some principles are noteworthy but many, I think, are pretty much useless in this dog-eat-dog world. But this doesn't mean that I'd not try out Mr.Carnegie's principles. And so I didn't regret reading it and you should try the book for yourself."
"902",901,"Allison Marsh","Don't Criticize, condemn or complain. Become genuinely interested in other people. Try to understand people. Why are they a certain way. What makes them act like they do? ""To know all is to forgive all"" Give Honest and Sincere appreciation. Smile. Doing so, people will appreciate your points of view and treasure them, possibly even repeat them.Arouse in the other person an eager want.Be a good listener. Encourage others to talk about themselves. Talk in terms of the other person's interests. Make the other person feel important - an do it sincerely. Show respect for the other person's opinions. Never say ""your wrong"". If your wrong admit it, quickly. Talk about your own mistakes before criticising the other person. Ask questions instead of giving direct orders. Use encouragement. Make the fault seem easy to correct. So these are the principles that I liked. The book wasn't that great. I had a hard time getting into it. "
"907",906,"Allen","The classic by Dale Carnegie is easier to read than I anticipated. I expected to read about a complicated formula for making friends and influencing others. Carnegie's book can easily be skimmed or if you like, you could simply read the last page of each chapter where he notes the single idea he presented in the chapter.The behaviors he recommends are basic to socializing in a winsome manner. I have already learned most of what I have read (I've read through the first two sections) through observing others and participating in conversations at church during fellowship and outreach. So far I have found the book helpful to review some of what I had already learned.There is no flow of thought in the writing. The author simply butts together multiple concrete examples of the concept he is trying to teach. This is why I find the chapters easy to skim."
"910",909,"Grant","I'd like to read more marketing/communications/PR books this year, so I thought I'd start with a classic. While this book may have been important in its time, I don't think it's terribly revolutionary in 2014: it's a lot of somewhat common sense wisdom that doesn't really transcend that. Important to keep in mind, but not mindblowing, and not the kind of read that will turn you from an introvert into an extravert. tl;dr - ""Try to listen to people, don't be a jackass, give (sincere) compliments readily."""
"913",912,"Bita","کتاب بسیار مفید برای ارتقائ روابط اجتماعی و موفقیت در آن."
"926",925,"Owais","I decided to give a look at http://en.wikipedia.org/wiki/How_to_W... before reading this book. I also extensively read the reviews on this website (and this review might be influenced by one of them).I did not read the whole book, and quickly scrolled through the pages. The examples seemed to be interesting, and the ideas author says (as summarized on Wiki) should definitely work. But for me it's more of a deception. Sure, I do need to use these skills at office, relatives, strangers.. but for friends and at least those whom I trust, I can't get the gist of things like:1- Don't criticize, condemn, or complain. (Get a therapist? We all have down times, I am sure if there is trust, a friend shall listen to me, unless I overdo it)2- Never show others that you are not interested in what they have to say. (Pure deception!)3- The only way to get the best of an argument is to avoid it. (Depends upon how you define argument, but difference of opinions and their respect is how you start trusting people and learning about life)4- Make the other person happy about doing what you suggest. (For business OK, for a trusted friend, no!)I read another book, in which the concept was more about character building, no quick self-fixes. This book while definitely should be used in work settings, businesses, maybe even families, but for those whom you trust, for me its more of a deception. My cup of tea!"
"965",964,"K.J. Kron","I actually like what this guy says - but it's pretty simple and considering all teh other books out there, I'd recommend others."
"971",970,"Linda Pettit","Too long ago--about 8th grade--"
"983",982,"Dylan Rankin","I'll save you the trouble of wallowing through the mass of surplus analogous 'evidence'. Simply be genuinely pleasant to be around, that's his crux, and I have to admit the books gives a real feeling of being spoon feed against ones will. If you really absolutely must 'indulge' in this particular self help tripe then I will permit a brief skim of the first few chapters, after which it devolves into teachings obviously aimed at fostering annoying passive aggression.If you want a real eye opener to the way REAL people think and act not the sterile automatons Dale Carnegie postulates where the word 'sorry' is a universal spell of omnipotent friend making, then read the 48 Laws of Power by Robert Greene. Can I rate a book 1 and a half??? "
"993",992,"Abdullah Alharbi","While the core of this book is valid and the principles work, reading it felt like it was telling how to be manipulative in a way. Even though the book kept emphasizing on being sincere and talk from the heart, most examples were given in a business context, it is not about people you meet in the street, it is not about friends who have nothing to do with your work, it's mostly about business and business only. That made me feel like the aim is not the moral itself, but rather, what morals can get you."
"1016",1015,"Oyu","just starting to read it... I will review it later"
"1034",1033,"Ashik","Interesting ideas in this book, but the book is very very repetitive. Just read the wikipedia article on this one."
"1037",1036,"Mary Robles","Self help books are good but not always what I like to read. "
"1045",1044,"Dhclaw","I sincerely doubt that this could actually help anyone make friends. It didn't help me overcome my shyness nor made me more appealing to others. Perhaps the only good thing about reading a book like this is forcing yourself to try harder around people throughout the process.So there's motivation, however the further you are, the weaker it gets, because the read is quite boring."
"1065",1064,"Glenda","Yes, I am a graduate of the course ... around 1989 or 1990 as I recall. Can you tell?"
"1069",1068,"Jamessteeleii","Read, ignore the blatant altruistic undertones, and take the practical implications of behavioural change in the dealing with difficult people."
"1088",1087,"Ashley Marmaro","I'm reading this for work. I was told it was written in the 1930s and I don't doubt it. The examples the use in the book are quite amusing because of the time period it was written in."
"1113",1112,"Gabriel Olmeda","Two great books I read this year kept referencing this book Susan Cain's Quiet and Stephen Coveys' 7 Habits so I decided to read this book. With that said, I already knew I had a bias against the ideas of this book. It was nice to take a step back into history but this book is apart 100 years old and our ideas of psychology have changed. This book is the greatest promoter of the ""personality ethic"" where you need to change outwardly to be effective. That in my view is a quick fix where I agree with Covey we need to start from within. Also Susan Cain mentioned how this book also promoted the ""extrovert ideal"" which is about how we emphasize extroversion in society. This books is all about this. Dale Carnegie writes simple things one can do to win friends like smiling or giving a compliment before criticism. He also kept mentioning how it had to be sincere. I believe sincerity comes from within not what you display outwardly so by this Carnegies method is outmoded. The writing was a bit annoying, it was as if someone just googled a smattering of anecdotes and quotes about subjects. There was little cohesion between the references just that it followed his chapter theme. Since it was almost 100 years ago I admire how much research he did. He even went into Chinese philosophy. All in all there are some hidden gems but this book should not be tired any longer as a must read for winning friends it is outdated. "
"1144",1143,"Pavel Tugarinov","мерзенькая книженция:)"
"1150",1149,"Jay Greiner","like i needed this. i was instructed to read. seriously, guys."
"1157",1156,"Messengerlikeyou","How to get your own way...what more can I say. All about self, good read if your a sociopath or psychopath and want to manipulate others. "
"1163",1162,"Kaitlyn Hughes","This should be titled ""How to Try to Manipulate Adults and Hope They are Idiots and Don't Pick Up On It."" For the love of God that was excruciating. The entire book could have been written as a 20 page essay, but it was a 300 page essay that dragged on and on with unrealistic example after unrealistic example: ""I walked into this guy's office and complimented the wood work, he talked about it for an hour then invited me to his house for dinner, then without me even asking he gave me the biggest sale I've ever made!"" Seriously. That is what I read in every chapter. It was annoying to what I thought would be no end. Just be nice to people and they'll like you! I gave this two little stars only because the points he made were good-ish. However, they could have been jotted down in bullet form, saving me my sanity, and a few hours of my life. Thank God it's over and I survived."
"1168",1167,"Manolina","I listened to this book and it was an ok experience; nothing new. The narration is old style.If we truly applied the points mentioned in our daily life we will benefit greatly."
"1206",1205,"David Darson","This was a book I won in a contest. All I can say is, it was worthless contesting in that contest and it was even more worthless reading this book. "
"1217",1216,"James Preston","It was an okay book I thought. Not sure if his examples and stuff are very realistic. Seemed like it was more a book full of people that got really lucky once in a while. The marriage advice at the end seemed good though."
"1221",1220,"Arsjaad","I can imagine that individuals who aren't familiar with the material presented in this book might find this a great and helpful book. But as a person who has been graduated in the field psychology, used be a salesman, and read many books related to this topic, I personally couldn't find any intriguing and interesting information.Skimmed + Read it till page 100 within 35 minutes. Not much to find. Also a lot of unnecessary long stories, but I guess that's the way the writer tries to make sense to the reader, especially back in those days."
