"","X","user","review"
"1986",1985,"Marquess","I have heard about and have been recommended this book so many times throughout the past few years but I resisted. I resisted because the title sounded like it could have just as easily been ""How to Manipulate People."" Yet, I read it because I have been assured time and time again that that is not the case and the advice contained within is quite valuable. They were right. This book is not really about manipulating people. Carnegie stresses this numerous times and every principle must be carried out sincerely. The advice isn't bad either. If you are new to the world of business relationships or maybe are not confident in your day to day conversations with acquaintances then this book can be really helpful and I think that is why it receives such high praise. Dale Carnegie's writing style is great. It is clear and easy to read. The book flows effortlessly.Still, I have a few complaints. The book is way too long for what it is. Each chapter could be trimmed down to just the principle of the chapter, a few choice excerpts, and maybe one example to drive the point home. Instead Carnegie repeats himself and offers way too many examples which are hardly convincing. It is all anecdotal evidence and some of it is so extraordinary that it is hard not to be skeptical of the advice. Even then, the principles aren't entirely unique each chapter. More often than not a principle is the same exact advice as a principle in a previous chapter. Other times, it is such a slight difference you wonder why two principles were not combined to one. The primary reason this book gets such a low score is that even though it was a short and quick read I feel it wasted my time. I only held out and finished it because it was so short and I just wanted to be able to have said I read it and form a fair opinion of it. Another reason is that while I think Carnegie means it when he says we should be sincere in all our interactions his principles contradict that. For example, one principle says we should ""become genuinely interested in other people."" This is something we can do genuinely with some people, for sure. But not everyone. It is insincere to say that we can be genuinely interested in EVERYbody and the mere fact that we are becoming interested on others based on a principle that we read in a book is a little insincere isn't it? Finally, it is poor advice with regards to real friendships. Carnegie's view of ""friendship"" is a utility for business. It is really a shame that people might read this book and think it is a way to carry yourself to making true friends that care about you. It is anything but that. It is a path towards making functional business relationships that benefit both parties. Trying to follow this advice in normal life will only succeed in surrounding yourself with self-centered people who don't care about you. Please remember that this book is not ""a way of life."" It was a way of life for Carnegie because his life was business and that is why he describes his book as such. In conclusion, it's okay advice (but only with business relationships). I see why it is given so much praise but I don't really like how it is presented and do not think it is advice that helps you express yourself as interesting or sincere. I also think there are people who will read this and believe it to be a way of life and approaching all relationships when that is not the case. It is a way of approaching functional business relationships not real friendships."
"1989",1988,"Geku","While most the one-liner tips and tricks to manipulate people - while being absolutely sincere [sic] - into giving you what you want seem timeless, the examples and explanations are outdated and the only true value I'd assign to this book in this century is historical. It offers a pretty fascinating view into the lives of American men in the first half of the 20th century, but all it really tells you is to be nice. Or trick people into thinking that you are.Fun fact: Charles Manson used what he learned from this book in prison to manipulate women into killing on his behalf. So there's that."
"2000",1999,"John Weston","It had a lot of good principles, but I seemed seemed to me that a lot of it was how to munipipulate people, instead of influence them. "
"2007",2006,"Rachel Jackson","For all the things I've heard about this book, it was a letdown. How To Win Friends And Influence is repetitive and boring, and completely undermines the premise of basic human relationships.Dale Carnegie spends the entire book telling the reader how to manipulate people — that's the gist of it. He positions it under the guise of being helpful in business relationships and making friends with people, but all it really is is a way to get ahead in life by positioning people where you want them. I didn't like how his message is only to please people so they please you. That sounds nice, but what if we try being nice to one another without ulterior motives? What an idea! One of his rules is to make other people like you by becoming genuinely interested in them. Why not be interested in them and not expect anything in return? Teaching men — and it's only men, naturally — to suck up to people to get what you want seems like a dumb thing to be a bestseller."
"2018",2017,"Nivaria Ramirez","Libro que te hace reflexionar muchísimo sobre la forma de tratar a los demás. Lo que más me ha gustado, ha sido el final, donde se relata la dura y cruda vida que tuvo el autor y aún así, consiguió el éxito. Todo merece su tiempo y todos tenemos la oportunidad de aprovecharlo. No suelo leer este tipo de libros pero te maravillas al comprender lo importante que es ser empático. Lo recomiendo a todos aquellos que somos un poco egoístas y egocéntricos, y todos lo somos alguna vez. Yo incluida, por supuesto."
"2024",2023,"shaan","I deeply regret the hour I spent reading this bourgeois crap and wish I had instead done something productive with my time, like dousing my neighbor's car in cooking oil then lighting it on fire. "
"2030",2029,"Aly Anwar","""Don't criticize, condemn, or complain."" Well , I decided to stop reading the book after reading this, however I managed to see Dale's point of view.""Why prove to a man he is wrong ? Is that going to make him like you ? Why not let him save his face? He didn't ask for your opinion.He didn't want it, why argue with him !?Always avoid the acute angle. "" Then I asked myself : Is it really going to work? Alas , the deepest urge in human nature is the desire to be IMPORTANT , the desire to be APPRECIATED.So yes , it works ; cause you simply give the other person that desire he needs.Second question will be : Don't you find it such a negative behavior ? I mean how can you live without condemning , criticizing , or complaining!Then I said okay maybe the concept he is talking about is regarding to the good things (Never criticize something that is good).Then I read this "" The only way to get the best of an argument is to avoid it""How can you be so surrendering Dale Carnegie !!!2 stars are for the awesome information regarding to dealing with people and influencing them , -3 stars for the surrendering messages in this book. "
"2042",2041,"Xatolos","""Always mention the good and never mention the bad""Pretty much sums up this book. It's got a few tidbits but for the most part its quite far from reality. It's designed to sell by making things sound good and work in your favour. But it ignores reality and assumes everyone wants to work, work hard, isn't greedy, lazy, wouldn't ever steal, or even be a psychopath. You know, real world people. While not everyone will be bad, but to assume everyone is good is a fatal flaw this book. It never points out you need to also realize that while for some you need to help build up, but for some people you just need to learn how and when to cut and take your losses."
"2048",2047,"Zac","This is a book written for assholes who don't know to naturally be kind. I've worked with businessmen who've obviously read this book or done one of the conferences, and they come off as phoney actors playing the role and following the equation of being a nice person. The best part of reading this book was learning to recognise the signs of someone who is normally a jerk, but who is trying to manipulate the people around them to behave a certain way. "
"2056",2055,"Stephan Engels","In my opinion the ideas outlined in this book aren't that useful in every day life. I f you're a salesperson or in politics, then you might find it it'll have some pointers. Just have compassion for other people and be true to yourself. To quote a favorite person: Do no harm, but take no shit."
"2060",2059,"Ahsan","This book did not help me win friends and influence people.I think Dale Carnegie may have oversold a bit with the title. A more appropriate title would have been 'How to have no defining characteristics, and opinions'.Was it just me, or did anyone else read this entire book with a thick, british accent?"
"2079",2078,"Ana","It was good to be reminded of some of what makes one endearing to others. However, maybe because of all the hype I was expecting more. Most of what the book talked about is so common sense. I kept expecting more from it and it never delivered. I was not able to finish reading it and chose to move to the next book on my list."
"2090",2089,"Brigette","It was good advice. I think this would've made a much better book if it was 1/3 the length..."
"2123",2122,"Matt Sutton","struggled to read. didn't finish. therefore, I am doomed."
"2139",2138,"Shannah","People often talk about how great this book is and how influential it has been on their lives, but I can't say that it had much of an impact on me. If any. Most of the advice given in the book seemed horribly obvious. The book has been updated and revised since the first edition in 1936, but many of the personal testimonies seemed very quaint and old-fashioned and wouldn't exactly translate to life in the new millennium. This isn't to say that everything in the book was not worth reading, but if you're expecting it to be earth-shattering you might need to lower your expectations. "
"2141",2140,"Steve Carney","You can basically sum this book with this: be kind/smile, everyone cares most about themselves, and remember that everyone wants to feel important. Perhaps more groundbreaking at the time of this classic's publishing, I found this book to be very common sensical with a tone I best perceive as pretentious. Still, I suppose the principles discussed in this book are a good starting point for those completely unaware of how to win friends and influence people."
"2155",2154,"Andrew Saul","As a self help book this really stinks. It's a whole lot of tips for success that only a complete psychopath would believe and follow with any conviction. But as a window into the minds of all those people ""striving for success"" who support the self help industry it's fascinating. This book is pretty historic as it basically started the booming self help industry we know today. It was (and still is) a raging success as it tapped into the fears many of failure many of us have that manifest themselves in low self esteem. For that reason (and that reason alone) it is worth reading. This book spawned a million imitators and is the reason we pretty much have Amway and other pyramid selling organisations. "
"2166",2165,"Phil Lamb","It has some good points. I don't like the strategies. If you act fake then people will vibe you are not being you. I think this book is shallow."
"2179",2178,"Caitlin Toliver","read this for my consumer psych course and I actually liked what he had to say, but it is quite repetitive."
"2210",2209,"Talani","I was so relieved to learn that all I have to do to win friends and influence people is to be a decent human being. I can't believe so much fuss has been made over his one. If your parents did a half decent job, all of the tips and tricks in this self help book will come very naturally to you. My condolences to you friends if you are the kind of person that finds these ideas novel."
"2221",2220,"Jean-François Lisée","Livre culte des vendeurs et des charmeurs, cet ouvrage des années 1930 est d'abord une longue pub pour les séminaires de formation de Dale Carnegie. Les exemples utilisés sont d'ailleurs tirés des références de l'époque: Lincoln, Théodore Roosevelt, les magnats industriels du tournant du siècle.Le cadre ou le citoyen irascible apprendra dans ce livre des règles de bon sens du vivre ensemble. Mais je ne conseille à aucun général d'armée en guerre d'en appliquer les préceptes. Ne dire que des choses gentilles à ses subordonnés n'est pas une technique infaillible."
"2232",2231,"Jenni","Good ideas, boring to read."
"2233",2232,"Nessisus Fountain","I'm not a fan of quote books. "
"2239",2238,"Anaszaidan","موجز الكتاب....امدح وامدح حتى تكسب صديقكلذلك لا أنصح بقراءاه رغم وجود بعض المقاطع التي تصلح لأن تكون أدباً وليس لتصحبح سلوك"
"2250",2249,"Abhishek","this book is good for those who wants to exploit the friendship for the sake of financial and political gain.one need not to be einstein to know this. "
"2263",2262,"Hayley Dryhurst","2.5 stars... The information in the book is useful, but I found all the stories illustrating the points to get quite repetitive. "
"2264",2263,"Shahda Mahouk","مكرر جدا"
